{
  "entry_id": "n4_070_rashii",
  "card_blurb": "把听来的碎消息捏成一句“八成是这样”。",
  "feel": "这句听起来像聊天里轻轻补一句：“我也不是百分之百确认，但听起来大概就是这么回事。”",
  "family_position": "它在“传闻・耳闻转述系”里，站的是“来源不明说，还带一点说话人自己判断”的那一格。比 `と聞いた` 少了明确来源，比 `そうだ` 更有一点模糊感，也没有 `と言われている` 那种像社会共识的距离感。",
  "scene_paragraph": "午休时，茶水间里有人压低声音说：正式通知还没发，不过听隔壁组提了几句，又看到田中最近一直在查大阪的房子，所以大家都觉得他下个月要调走。这个时候最顺手的就是 `らしい`。它不是把谁的话原封不动地搬出来，也不是官方口径，而是把“听来的消息 + 一点自己的拼接判断”说成一句自然的“好像是这样”。",
  "scene_examples": [
    {
      "tag": "办公室传闻",
      "jp_ruby": "正式[せいしき]な発表[はっぴょう]はまだだけど、田中[たなか]さん、来月[らいげつ]大阪[おおさか]に転勤[てんきん]するらしいよ。",
      "zh": "还没正式公布，不过听说田中下个月要调去大阪。",
      "note": "没官宣，只是同事之间慢慢传开的消息。"
    },
    {
      "tag": "学校消息",
      "jp_ruby": "来週[らいしゅう]の小[しょう]テスト、漢字[かんじ]はあまり出[で]ないらしい。",
      "zh": "听说下周的小测验里汉字不会出很多。",
      "note": "像学生之间互通消息，来源也不一定很清楚。"
    },
    {
      "tag": "生活经验",
      "jp_ruby": "このアプリ、夜[よる]のほうが予約[よやく]しやすいらしいよ。",
      "zh": "听说这个应用晚上更容易约到。",
      "note": "来自朋友和网友经验，不是官方说明。"
    }
  ],
  "formula": "普通形（動詞・いA）／なA语干／名詞 + らしい",
  "formula_explainer": "前面放“内容本体”，后面接 `らしい`，说成“听说……／好像……”。动词和い形直接接；名词、な形前不加 `だ`。过去式、否定式也能照样接进去，比如 `来[こ]ないらしい`、`休[やす]みだったらしい`。",
  "structure_cards": [
    {
      "label": "普通形 + らしい",
      "note": "把听来的动作、变化、状态直接挂在后面。",
      "jp_ruby": "明日[あした]は午後[ごご]から雨[あめ]になるらしい。",
      "zh": "听说明天下午开始会下雨。",
      "mini_note": "动词、い形都能直接接。"
    },
    {
      "label": "名词／な形 + らしい",
      "note": "对身份、属性、状态做“听说是……”的判断。",
      "jp_ruby": "あの人[ひと]、新[あたら]しい店長[てんちょう]らしい。",
      "zh": "听说那个人是新店长。",
      "mini_note": "名词和な形前不要加 `だ`。"
    },
    {
      "label": "〜らしいよ／〜らしいです",
      "note": "核心意思不变，只是把口气调成随口分享或较礼貌转述。",
      "jp_ruby": "この電車[でんしゃ]、次[つぎ]は止[と]まらないらしいです。",
      "zh": "听说这班电车下一站不停。",
      "mini_note": "`よ` 更像聊天分享，`です` 更礼貌。"
    }
  ],
  "usage_points": [
    "本条是“传闻／听说”的 `らしい`，不是 `子どもらしい` 那种“很像……、有……风格”的 `らしい`。",
    "它常常来自零碎信息：别人提了一句、群里看到一条、再加一点现场迹象，所以语气像“八成如此，但我不打包票”。",
    "跟同一家族相比，`らしい` 比 `そうだ` 更糊一点，比 `と聞いた` 更不交代来源。",
    "接续上很好用：动词、い形直接接；名词、な形前不加 `だ`，如 `先生[せんせい]らしい`、`元気[げんき]らしい`。",
    "普通形里的时态和否定都能保留，所以 `来[こ]ないらしい`、`遅[おそ]かったらしい` 这种句子很常见。",
    "句尾常跟 `よ`、`けど`、`です` 一起出现，用来调节亲疏感、保留感和礼貌度。"
  ],
  "contrasts": [
    {
      "other_entry_id": "n4_081_sou_da_1",
      "title": "らしい vs そうだ",
      "self_label": "零碎消息拼出的“好像”",
      "other_label": "直接把得到的消息转给你",
      "difference": "两者都常译成“听说”，但 `そうだ` 更像把某条信息直接转述出来；`らしい` 更像听了几耳朵、再加一点自己的判断，所以语气更松、更模糊。",
      "example_self": {
        "jp_ruby": "田中[たなか]さんは来月[らいげつ]大阪[おおさか]に転勤[てんきん]するらしい。",
        "zh": "听说田中下个月好像要调去大阪。",
        "note": "来源不点明，像办公室里慢慢传开的消息。"
      },
      "example_other": {
        "jp_ruby": "田中[たなか]さんは来月[らいげつ]大阪[おおさか]に転勤[てんきん]するそうだ。",
        "zh": "听说田中下个月要调去大阪。",
        "note": "像把收到的消息直接转述出来。"
      },
      "exam_handle": "空格前后如果只是“听说啦、好像啦”那种模糊传闻感，优先想 `らしい`；如果更像把一条消息原样告诉别人，想 `そうだ`。"
    },
    {
      "other_entry_id": "n4_113_to_kiita",
      "title": "らしい vs と聞いた",
      "self_label": "不点来源地说“听说”",
      "other_label": "把“我听到的”说出来",
      "difference": "`と聞いた` 会把“听”这个动作摆到台前，像你真的是从谁那里听来的；`らしい` 不交代消息入口，只把结果轻轻丢出来。",
      "example_self": {
        "jp_ruby": "駅前[えきまえ]のカフェ、今月[こんげつ]で閉店[へいてん]するらしい。",
        "zh": "听说车站前那家咖啡店这个月就要关门了。",
        "note": "随口转传，不强调是从谁那里听来的。"
      },
      "example_other": {
        "jp_ruby": "駅前[えきまえ]のカフェは今月[こんげつ]で閉店[へいてん]すると聞[き]いた。",
        "zh": "我听说车站前那家咖啡店这个月就要关门了。",
        "note": "明确告诉你：这是我听来的消息。"
      },
      "exam_handle": "如果题目里出现了 `友達[ともだち]に`、`先生[せんせい]から`、`ニュースで` 之类明确来源，空格常更偏向 `と聞いた`；如果只剩下模糊的“听说”，更像 `らしい`。"
    },
    {
      "other_entry_id": "n4_112_to_iwarete_iru",
      "title": "らしい vs と言われている",
      "self_label": "这次听来的消息",
      "other_label": "大家都这么说的评价／说法",
      "difference": "`らしい` 更像当下听来的传闻或判断；`と言われている` 更像已经流传开的普遍说法、社会评价或文章体表达，个人说话人的存在感更弱。",
      "example_self": {
        "jp_ruby": "この温泉[おんせん]は肌[はだ]にいいらしい。",
        "zh": "听说这个温泉对皮肤很好。",
        "note": "像朋友推荐时顺口说的。"
      },
      "example_other": {
        "jp_ruby": "この温泉[おんせん]は肌[はだ]にいいと言[い]われている。",
        "zh": "这个温泉据说对皮肤很好。",
        "note": "像宣传介绍或一般流传的说法。"
      },
      "exam_handle": "如果空格处要表达“社会上普遍这么说”“大家一般这么认为”，选 `と言われている`；如果只是说话人现在听来的消息，选 `らしい`。"
    }
  ],
  "memory_chain": "把这家人串起来记：`と聞いた` 是“我听谁说”；`そうだ` 是“把听到的话转给你”；`と言われている` 是“社会上普遍这么说”；`らしい` 则是“我听来一点、也拼了一点，所以大概是这样”。做题时先问自己：消息源是不是明确？是不是公共说法？如果都不是，只是模糊传闻，那就很可能是 `らしい`。"
}