{
  "entry_id": "n4_052_nakereba_ikenai",
  "card_blurb": "不是“有这个必要”，而是“这件事不做不行了”。`なければいけない` 是日常里很常见的“必须”，带着规则、期限或责任压上来的感觉。",
  "feel": "这句听起来像人在现实面前叹口气：不是我多想做，而是现在不做会不行。比起冷静说明“有必要”，它更像把人推进动作里的“得做”。",
  "family_position": "它站在这个家族里“义务真正落到人身上”的那一格：比`必要がある`更像规矩、截止、职责在催你；比`なければならない`又更口语、更像真实会话里会说出口的“没办法，得做”。",
  "scene_paragraph": "晚上十点，朋友发消息问你要不要出来吃夜宵，你看了一眼桌上的文件和手机提醒，只能摇头。明天一早就要交材料，今天不弄完就来不及了。`なければいけない` 很适合这种小镜头：人未必情愿，但时间、规则、手续、责任已经把选择收窄成“这件事现在得做”。",
  "scene_examples": [
    {
      "tag": "工作截止",
      "jp_ruby": "今日[きょう]中[じゅう]に見積書[みつもりしょ]を送[おく]らなければいけない。先方[せんぽう]が明日[あした]の会議[かいぎ]で使[つか]うらしい。",
      "zh": "今天之内必须把报价单发过去，对方明天开会要用。",
      "note": "一有截止时间，这个句型就会很自然地冒出来。"
    },
    {
      "tag": "考试前夜",
      "jp_ruby": "眠[ねむ]いけど、明日[あした]小[しょう]テストだから、あと少[すこ]し勉強[べんきょう]しなければいけない。",
      "zh": "虽然很困，但明天有小测，还得再学一会儿。",
      "note": "很有“唉，没办法”的口气。"
    },
    {
      "tag": "办手续",
      "jp_ruby": "市役所[しやくしょ]が五時[ごじ]に閉[し]まるから、その前[まえ]に住民票[じゅうみんひょう]を取[と]りに行[い]かなければいけない。",
      "zh": "市政府五点关门，所以我得在那之前去拿住民票。",
      "note": "手续、营业时间、规定，这类外部条件特别适合它。"
    }
  ],
  "formula": "V（ない形）-い + ければいけない",
  "formula_explainer": "字面上是“如果不做，就不行”。所以它不是在说愿望，也不是单纯分析必要性，而是在说：这件事已经带上了义务感，不做会有麻烦。",
  "structure_cards": [
    {
      "label": "期限 + なければいけない",
      "note": "最常见的骨架，常和`までに`一起出现。",
      "jp_ruby": "金曜[きんよう]までに申[もう]し込[こ]まなければいけない。",
      "zh": "周五前必须申请。",
      "mini_note": "有明确截止点时特别顺。"
    },
    {
      "label": "理由 + から + なければいけない",
      "note": "先交代“为什么不做不行”。",
      "jp_ruby": "明日[あした]は朝[あさ]が早[はや]いから、もう寝[ね]なければいけない。",
      "zh": "明天一早有事，所以我现在得睡了。",
      "mini_note": "很像日常口语里的自我提醒。"
    },
    {
      "label": "なければいけないんです",
      "note": "用来向别人解释自己的安排或难处。",
      "jp_ruby": "今日[きょう]は病院[びょういん]に行[い]かなければいけないんです。",
      "zh": "我今天得去医院。",
      "mini_note": "加上`んです`后，说明感更强，也更柔和。"
    }
  ],
  "usage_points": [
    "它常出现在“规则、期限、职责、手续”这些外部压力很强的场面，不太像纯自愿计划。",
    "和`必要がある`相比，它更像人在现实里被推着走；不是抽象地说“有必要”，而是具体地说“得去做”。",
    "日常会话里很常用，比`なければならない`自然；口语里还常缩成`なきゃいけない`、`なくちゃいけない`。",
    "前面常搭配`までに`、`から`、`ので`这类线索，告诉你“为什么现在不做不行”。",
    "说自己时很自然；拿来对别人说时，会带出要求、提醒甚至规矩感，语气轻重要看关系。",
    "它的过去式`なければいけなかった`也很常见，表示“当时本来必须做”或“不得不做过”。"
  ],
  "contrasts": [
    {
      "other_entry_id": "n4_021_hitsuyou_ga_aru",
      "title": "なければいけない vs 必要がある",
      "self_label": "规矩或截止压出来的“必须”",
      "other_label": "冷静说明“有这个必要”",
      "difference": "`なければいけない` 把人推进动作里，像“这不做不行了”；`必要がある` 更像判断或说明，重点是“有必要这么做”。",
      "example_self": {
        "jp_ruby": "明日[あした]までにこの書類[しょるい]を出[だ]さなければいけない。",
        "zh": "明天之前必须把这份文件交掉。",
        "note": "人被期限推着走。"
      },
      "example_other": {
        "jp_ruby": "明日[あした]までにこの書類[しょるい]を出[だ]す必要[ひつよう]がある。",
        "zh": "明天之前有必要把这份文件交掉。",
        "note": "更像在说明必要性。"
      },
      "exam_handle": "空格前后如果有截止、规定、老师要求、公司要求这类“没做会不行”的线索，优先想`なければいけない`；如果是在客观分析“有必要”，优先想`必要がある`。"
    },
    {
      "other_entry_id": "n4_053_nakereba_naranai",
      "title": "なければいけない vs なければならない",
      "self_label": "口语里常说的“必须”",
      "other_label": "更正式、更硬一点的“必须”",
      "difference": "两者都表示义务，但`なければいけない`更像日常会话；`なければならない`更书面、更像通知、规则、正式发言。",
      "example_self": {
        "jp_ruby": "参加者[さんかしゃ]は九時[くじ]までに会場[かいじょう]に来[こ]なければいけない。",
        "zh": "参加者必须在九点前到会场。",
        "note": "放在口头说明里很自然。"
      },
      "example_other": {
        "jp_ruby": "参加者[さんかしゃ]は九時[くじ]までに会場[かいじょう]に来[こ]なければならない。",
        "zh": "参加者必须在九点前到会场。",
        "note": "更像正式规定或公告。"
      },
      "exam_handle": "如果题目像朋友提醒、老师口头说、日常对话，优先`なければいけない`；如果语体偏正式、像校规通知或书面说明，优先`なければならない`。"
    },
    {
      "other_entry_id": "n4_013_ga_hitsuyou",
      "title": "なければいけない vs が必要",
      "self_label": "人必须去做某个动作",
      "other_label": "某个东西或条件是必需的",
      "difference": "`なければいけない` 接动词，焦点是“谁得做什么”；`が必要` 接名词，焦点是“需要什么条件、材料或东西”。",
      "example_self": {
        "jp_ruby": "このイベントに入[はい]るなら、先[さき]に予約[よやく]しなければいけない。",
        "zh": "想参加这个活动的话，必须先预约。",
        "note": "动作本身被要求去做。"
      },
      "example_other": {
        "jp_ruby": "このイベントは予約[よやく]が必要[ひつよう]だ。",
        "zh": "这个活动需要预约。",
        "note": "把“预约”当成必要条件来讲。"
      },
      "exam_handle": "如果空格前已经是动词相关线索，多半接`なければいけない`；如果前面是名词，像`予約___`、`許可___`、`身分証___`，通常更该想`が必要`。"
    }
  ],
  "memory_chain": "先看“需要的是什么东西/条件”时，用`が必要`；再往前一步，说“做这件事有必要”，是`必要がある`；再把压力真正压到人和动作上，就变成`なければいけない`；如果还要再正式、更硬一点，就走到`なければならない`。这条线记住了，这一家族就不会混成一团。"
}