{
  "entry_id": "n2_015_de_shika_nai",
  "card_blurb": "把某个东西定性成“不过只是个X”，常带一点降温、纠偏、压低分量的语气。",
  "feel": "像有人把你心里越滚越大的东西按回桌面：先别放大，它不过就是这么一回事。",
  "family_position": "它在这个家族里站“名词降格”这一格：不像 `のみ` 那样只是客观圈范围，也还没到 `にほかならない` 那种拍板本质；它最擅长把某物压回“只是个X”的身份。",
  "scene_paragraph": "会议室里，新方案的预测数字刚一写上白板，空气就突然紧起来，仿佛方向已经定了、风险已经来了。这时候前辈一句“这还只是初步试算”，就把大家从过度解读里拉回来。`でしかない` 很像这种瞬间：不是单纯说“只有”，而是把一个被看大、看重、看严重的东西，重新压回它当前真正的大小。",
  "scene_examples": [
    {
      "tag": "会议室",
      "jp_ruby": "この数字[すうじ]は初期[しょき]の試算[しさん]でしかないので、まだ決定[けってい]ではありません。",
      "zh": "这个数字只是初步估算，还不是最终决定。",
      "note": "把听上去很确定的东西拉回“只是参考”。"
    },
    {
      "tag": "群聊八卦",
      "jp_ruby": "その人事[じんじ]の話[はなし]、今[いま]は社内[しゃない]の噂[うわさ]でしかないらしい。",
      "zh": "那个人事消息，现在看来还只是公司里的传言。",
      "note": "常见于消息未证实时的降温。"
    },
    {
      "tag": "分工说明",
      "jp_ruby": "私[わたし]は通訳[つうやく]でしかないので、契約[けいやく]の条件[じょうけん]は本人[ほんにん]どうしで確認[かくにん]してください。",
      "zh": "我只是翻译，合同条件请当事人双方自己确认。",
      "note": "用来划清角色边界，很自然。"
    }
  ],
  "formula": "Aは / が Nでしかない",
  "formula_explainer": "最自然的是接名词。说话人把 A 的性质、身份、阶段、分量压到“不过就是 N”这一层，常见于角色、阶段、传闻、结果、借口这类“定性名词”。",
  "structure_cards": [
    {
      "label": "ただのNでしかない",
      "note": "先把东西降格，再下判断。",
      "jp_ruby": "それはただの勘違[かんちが]いでしかないよ。",
      "zh": "那不过就是个误会而已。",
      "mini_note": "`ただの` 一放进去，“不过如此”的味道更明显。"
    },
    {
      "label": "N1ではなく、N2でしかない",
      "note": "纠正别人把事情看大的理解。",
      "jp_ruby": "これは終[お]わりではなく、やり直[なお]しの始[はじ]まりでしかない。",
      "zh": "这不是结束，只不过是重来的开始。",
      "mini_note": "前面否定大词，后面换成更小、更准的定性。"
    },
    {
      "label": "Nでしかないが、…",
      "note": "先压低身份，再补充后文。",
      "jp_ruby": "私[わたし]は案内[あんない]役[やく]でしかないが、会場[かいじょう]の流[なが]れは説明[せつめい]できます。",
      "zh": "我只是负责引导的人，不过会场流程我能说明。",
      "mini_note": "很常见于先自谦、先划清职责的说法。"
    }
  ],
  "usage_points": [
    "它最自然地接在名词后面，尤其适合“身份、角色、阶段、评价”这类名词，比如传闻、初稿、借口、结果、工作人员。",
    "语感里常有“别想大了”的回拉动作。既可以是冷静纠偏，也可能带一点不留情的否定感。",
    "和 `ただの`、`一つの` 之类词一起用时，降格感更强，常带“说穿了也就这样”的味道。",
    "如果前面不是名词，而是数量、动作、状态，很多时候换成 `にすぎない` 会更顺，也更常见。",
    "它很适合用来划清边界或自谦，比如“我只是翻译”“这只是中间结果”，说的是‘别把责任或意义放太大’。",
    "别和“V辞书形 + しかない（只好……）”混在一起；`でしかない` 里的重点不是“没办法”，而是“不过就是”。"
  ],
  "contrasts": [
    {
      "other_entry_id": "n2_118_nomi",
      "title": "でしかない vs のみ",
      "self_label": "不过就是X",
      "other_label": "只有X",
      "difference": "`のみ` 是冷静地圈定范围，像规则、公告、书面说明；`でしかない` 是把某物定性为“不过是个X”，带一点主观降格或纠偏。",
      "example_self": {
        "jp_ruby": "この案[あん]はたたき台[だい]でしかないので、遠慮[えんりょ]なく直[なお]してください。",
        "zh": "这个方案不过是个初稿，请尽管改。",
        "note": "强调它的性质只是“拿来修改的草案”。"
      },
      "example_other": {
        "jp_ruby": "今日[きょう]はたたき台[だい]のみ共有[きょうゆう]します。",
        "zh": "今天只共享初稿。",
        "note": "强调共享范围，语气客观。"
      },
      "exam_handle": "如果空格前后是在给某物“定性”，意思像“不过就是个……”，优先想 `でしかない`；如果是在说“只限于哪些对象/范围”，更像 `のみ`。"
    },
    {
      "other_entry_id": "n2_108_ni_suginai",
      "title": "でしかない vs に過ぎない（にすぎない）",
      "self_label": "不过就是X",
      "other_label": "只不过是X",
      "difference": "两者很近。`でしかない` 更像会话里把东西按回一个名词身份，常接名词；`にすぎない` 更平稳、更书面，接续也更广，数量、动作、普通形都能接。",
      "example_self": {
        "jp_ruby": "今回[こんかい]の発表[はっぴょう]は中間[ちゅうかん]報告[ほうこく]でしかない。",
        "zh": "这次发表不过是中期汇报。",
        "note": "直接把它定性成“只是中期汇报”。"
      },
      "example_other": {
        "jp_ruby": "今回[こんかい]の発表[はっぴょう]は中間[ちゅうかん]報告[ほうこく]にすぎない。",
        "zh": "这次发表只不过是中期汇报。",
        "note": "意思几乎一样，但更像说明文或论述文。"
      },
      "exam_handle": "前面如果是名词，两者都可能；想要更像会话里纠偏、降格，抓 `でしかない`。如果前面是数量、动词普通形，基本就往 `にすぎない` 想。"
    },
    {
      "other_entry_id": "n2_087_ni_hoka_naranai",
      "title": "でしかない vs にほかならない",
      "self_label": "不过就是X",
      "other_label": "说到底正是X",
      "difference": "`でしかない` 是往下压，把东西说小；`にほかならない` 是往核心钉死，说“这正是它的本质/原因”。一个在降格，一个在归结。",
      "example_self": {
        "jp_ruby": "あの謝罪[しゃざい]は時間[じかん]かせぎでしかない。",
        "zh": "那次道歉不过是在拖时间。",
        "note": "把表面动作压成一个较低的评价。"
      },
      "example_other": {
        "jp_ruby": "あの謝罪[しゃざい]の遅[おそ]さは、責任[せきにん]を認[みと]めたくない気持[きも]ちの表[あらわ]れにほかならない。",
        "zh": "那次道歉拖那么久，说到底正是不想承担责任的表现。",
        "note": "不是降格，而是指出背后的本质。"
      },
      "exam_handle": "如果句子是在说“别想大了，它不过是……”，选 `でしかない`；如果是在下判断“这正说明/正是……”，选 `にほかならない`。"
    }
  ],
  "memory_chain": "把这家族记成一条线：`のみ` 先客观地圈住范围；`でしかない` 再把东西压回“不过是个X”的大小；`にすぎない` 把这种“不过如此”扩展到更广的接续里；到了 `にほかならない`，方向一转，不再说“小”，而是说“说到底正是这个本质”。记忆口令可以是：只有X -> 不过就是X -> 只不过是X -> 说到底正是X。"
}