{
  "entry_id": "n2_183_ue_wa",
  "card_blurb": "「上は」不是平平的“既然”，而是“既然都接了、都走到这一步了，就得把后面的责任扛起来”。前件一成立，后件常接决心、义务，或“只能这样了”的推进。",
  "feel": "这句听起来像把退路轻轻关上：既然都答应了、都到这一步了，那后面就不能散漫，只能拿出担当。它有一点郑重，也有一点“说了就算数”的硬气。",
  "family_position": "它在本家族里站在“既然都扛到自己肩上了”的那一格。`からには`是广义版“既然”，`以上は`更像从事实或立场往下推理，而`上は`最强调当事人已经接招，于是后面必须拿出责任感。",
  "scene_paragraph": "客户简报前二十分钟，原本要主讲的前辈突然发烧，会议室外已经能听见对方公司的人声。你本来只负责数据页，却被部长看着问一句“你能上吗”。这时你深吸一口气，说：`引[ひ]き受[う]けた上[うえ]は、ちゃんと説明[せつめい]します。` 这里的`上は`不是普通的“因为我要上台”，而是“既然我已经接了，这份责任我就会扛起来”。",
  "scene_examples": [
    {
      "tag": "项目临危受命",
      "jp_ruby": "部長[ぶちょう]、私[わたし]がやります。引[ひ]き受[う]けた上[うえ]は、中途[ちゅうと]半端[はんぱ]なものは出[だ]しません。",
      "zh": "部长，我来做。既然接下了，我就不会交半吊子的东西。",
      "note": "前件一落地，后件马上变成承担和表态。"
    },
    {
      "tag": "比赛上场前",
      "jp_ruby": "明日[あした]、先発[せんぱつ]で出[で]る上[うえ]は、守[まも]りに入[はい]らず思[おも]い切[き]って投[な]げたいです。",
      "zh": "明天既然要先发上场，我不想缩手缩脚，想痛痛快快地投。",
      "note": "不是单纯说明安排，而是在说自己的觉悟。"
    },
    {
      "tag": "事到如今",
      "jp_ruby": "こうなった上[うえ]は、もう黙[だま]っていても仕方[しかた]ない。今夜[こんや]、全部[ぜんぶ]話[はな]そう。",
      "zh": "既然都走到这一步了，再沉默也没用了。今晚把一切都说开吧。",
      "note": "高频的“事到如今，只能往下做”的感觉。"
    }
  ],
  "formula": "V-る / V-た + 上は",
  "formula_explainer": "前面多放“已经决定、已经接下、已经发展成这样”的前提；后面不接轻飘飘的描述，而接`～なければならない`、`～つもりだ`、`～しかない`这类带责任、决心、不得不的回应。",
  "structure_cards": [
    {
      "label": "接了就得做完",
      "note": "最标准的承担型用法：前件是已接受，后件是义务。",
      "jp_ruby": "引[ひ]き受[う]けた上[うえ]は、最後[さいご]までやり抜[ぬ]かなければならない。",
      "zh": "既然接下了，就必须做到底。",
      "mini_note": "`Vた上は` + 义务"
    },
    {
      "label": "要上场就认真来",
      "note": "前件也可以用辞书形，只要这件事已经被说话人认领。",
      "jp_ruby": "大会[たいかい]に出[で]る上[うえ]は、本気[ほんき]で練習[れんしゅう]するつもりだ。",
      "zh": "既然要参赛，我就打算认真训练。",
      "mini_note": "`Vる上は` + 决心"
    },
    {
      "label": "事到如今只能这样",
      "note": "`こうなった上は`很像整块记忆的“事到如今”。",
      "jp_ruby": "こうなった上[うえ]は、逃[に]げるより先[さき]に謝[あやま]るしかない。",
      "zh": "事到如今，与其逃避，不如先道歉。",
      "mini_note": "局面已定 + `しかない`"
    }
  ],
  "usage_points": [
    "`上は`后面最自然的是责任、义务、决心、觉悟；如果后件只是客观结果，力道往往不对。",
    "前件常是“已经接下”“已经决定”“已经被选上”“已经变成这样”这类既成前提，所以很适合`引き受ける`、`決める`、`選ばれる`、`こうなる`一类语境。",
    "常见后件是`～なければならない`、`～べきだ`、`～つもりだ`、`～しかない`，一看就是“前提成立后，责任跟着落下”。",
    "语气比`からには`更郑重、更书面，也更有一点旧式、硬朗的说话感。",
    "`こうなった上は`是高频块，几乎可以整块记成“既然都到这一步了 / 事到如今”。",
    "`Vる上は`也能用，但前提必须是说话人已经认领的安排或决定；如果只是一般条件句，就不太像它。"
  ],
  "contrasts": [
    {
      "other_entry_id": "n2_050_kara_niwa",
      "title": "上は vs からには",
      "self_label": "既到这一步的觉悟",
      "other_label": "通用型既然",
      "difference": "两者都能译成“既然”。但`からには`更通用、更口语；`上は`更像把退路封上，常用于已接手、已决定、已走到这一步的场面，觉悟感更强。",
      "example_self": {
        "jp_ruby": "引[ひ]き受[う]けた上[うえ]は、途中[とちゅう]で投[な]げ出[だ]せません。",
        "zh": "既然接下了，就不能半途而废。",
        "note": "把“接了”说成一种不能后退的承担。"
      },
      "example_other": {
        "jp_ruby": "引[ひ]き受[う]けたからには、途中[とちゅう]で投[な]げ出[だ]せません。",
        "zh": "既然接下了，就不能半途而废。",
        "note": "意思接近，但口气更日常、更泛用。"
      },
      "exam_handle": "两个都可能进“引き受けた___、途中で投げ出せない”。如果题目整体语气更郑重，或前后都带“担当、觉悟、说到做到”的味道，优先选`上は`。"
    },
    {
      "other_entry_id": "n2_032_ijou_wa",
      "title": "上は vs 以上は",
      "self_label": "接任后的自我承担",
      "other_label": "从立场推出应然",
      "difference": "`以上は`更像从身份、事实、立场推出“理应如此”，逻辑感更重；`上は`更像当事人说“既然我已经接了，那我就负责到底”，主体承担感更强。",
      "example_self": {
        "jp_ruby": "会長[かいちょう]を引[ひ]き受[う]けた上[うえ]は、最後[さいご]まで責任[せきにん]を持[も]ちます。",
        "zh": "既然接下了会长这职位，我就会负责到底。",
        "note": "重点在“我已经接任了”。"
      },
      "example_other": {
        "jp_ruby": "会長[かいちょう]である以上[いじょう]は、最後[さいご]まで責任[せきにん]を持[も]つべきだ。",
        "zh": "既然是会长，就应该负责到底。",
        "note": "重点在“你既然是这个身份”。"
      },
      "exam_handle": "如果前件是身份、立场、规则判断，如“学生である”“責任者である”，多半选`以上は`；如果前件是“接了、决定了、变成这样了”，而后件是自己的承担，优先`上は`。"
    },
    {
      "other_entry_id": "n2_144_sore_nara",
      "title": "上は vs それなら",
      "self_label": "任务落到自己身上",
      "other_label": "听到情况后的顺势提议",
      "difference": "`それなら`只是听到信息后的反应，相当于“那样的话”；`上は`则是前提已经被自己接住了，后面跟的是责任和决心。",
      "example_self": {
        "jp_ruby": "明日[あした]発表[はっぴょう]する上[うえ]は、数字[すうじ]の根拠[こんきょ]まで全部[ぜんぶ]確認[かくにん]しておきます。",
        "zh": "既然明天要发表，我会把数字依据全都确认好。",
        "note": "前提已经落到说话人自己身上。"
      },
      "example_other": {
        "jp_ruby": "明日[あした]発表[はっぴょう]するの？ それなら、数字[すうじ]の根拠[こんきょ]まで全部[ぜんぶ]確認[かくにん]しておこう。",
        "zh": "明天要发表吗？那样的话，把数字依据也都确认一下吧。",
        "note": "听到情况后顺势给出建议。"
      },
      "exam_handle": "`それなら`常常像一句独立的“那样的话”，接在对话信息后面；如果空格前本身已经是完整前件，后面又接责任、决心、只能如何，那就更像`上は`。"
    }
  ],
  "memory_chain": "先听到情况、顺着接话，用`それなら`；把前提正式立住，说广义的“既然”可用`からには`；从身份、立场、事实推出应然，偏`以上は`；轮到自己亲自接下、说“既然都扛上了”，就是`上は`；而`てこそ`则不是逼你负责，而是回过头说“正因为做到了那个前提，意义才真正成立”。"
}