{
  "entry_id": "n2_131_osore_ga_aru",
  "card_blurb": "一听就像风险提示：还没出事，但已经不能掉以轻心。",
  "feel": "这句听起来像新闻字幕、医生说明或公司邮件里的克制警报：不是在慌张喊“完了”，而是在冷静地说“风险已经大到必须提醒”。",
  "family_position": "它在本家族里站“明确风险”这一格：比 `かねない` 更客观、更像警示牌；还没走到 `果たして` 那种盯着结果看的悬念感。",
  "scene_paragraph": "晚上十点，手机跳出市政府的防灾通知：河川水位持续上升，低洼地区有积水风险。你读到这种句子时，会感觉这不是谁在主观瞎猜，而是监测数据已经把“危险”摆上台面。`恐れがある` 就活在这种场面里：事情还没真的发生，但已经不能再装作没看见。",
  "scene_examples": [
    {
      "tag": "暴雨预警",
      "jp_ruby": "今夜[こんや]は雨量[うりょう]が急[きゅう]に増[ふ]える見込[みこ]みで、低[ひく]い土地[とち]では浸水[しんすい]の恐[おそ]れがあります。",
      "zh": "今晚预计雨量会猛增，地势低的地方有积水风险。",
      "note": "像天气播报，冷静但不轻。"
    },
    {
      "tag": "公司邮件",
      "jp_ruby": "古[ふる]い名簿[めいぼ]をそのまま共有[きょうゆう]すると、個人情報[こじんじょうほう]が社外[しゃがい]に漏[も]れる恐[おそ]れがあります。",
      "zh": "如果直接共享旧名单，个人信息有泄露到公司外部的风险。",
      "note": "规章语气，不是在“瞎担心”。"
    },
    {
      "tag": "医生说明",
      "jp_ruby": "この薬[くすり]は空腹[くうふく]のまま飲[の]むと、胃[い]を強[つよ]く刺激[しげき]する恐[おそ]れがあります。",
      "zh": "这种药如果空腹服用，可能会强烈刺激胃部。",
      "note": "说明书和医嘱里很常见。"
    }
  ],
  "formula": "V（辞書形）／Nの + 恐[おそ]れがある",
  "formula_explainer": "前面放“会通向坏结果的动作、状态或名词风险点”，后面用“恐れがある”把它说成一种客观存在的危险。重点不是谁在害怕，而是“这个局面有风险”。",
  "structure_cards": [
    {
      "label": "动词原形接续",
      "note": "前面是会引发坏结果的动作或状态。",
      "jp_ruby": "このまま工事[こうじ]を続[つづ]けると、周辺[しゅうへん]の住宅[じゅうたく]に被害[ひがい]が出[で]る恐[おそ]れがある。",
      "zh": "再这样施工下去，周边住宅有可能受损。",
      "mini_note": "最标准的 `Vる + 恐れがある`。"
    },
    {
      "label": "名词风险型",
      "note": "灾害、故障、误解这类名词尤其常见。",
      "jp_ruby": "この地域[ちいき]では、今夜[こんや]遅[おそ]くから土砂崩[どしゃくず]れの恐[おそ]れがあります。",
      "zh": "这个地区今晚稍晚开始有发生山体滑坡的危险。",
      "mini_note": "`Nの恐れがある` 很像公告牌措辞。"
    },
    {
      "label": "も 版本",
      "note": "想表达“甚至连这个坏结果也得算进去”时常用。",
      "jp_ruby": "対応[たいおう]がさらに遅[おく]れれば、契約[けいやく]そのものが白紙[はくし]になる恐[おそ]れもある。",
      "zh": "如果应对再拖下去，甚至连合同本身都有可能作废。",
      "mini_note": "`も` 会把风险再往上推一层。"
    }
  ],
  "usage_points": [
    "`恐れがある` 常带公告、新闻、报告、说明书味道，比 `かねない` 更正式、更客观。",
    "它几乎只接坏结果：事故、恶化、流出、误解、延误。好事一般不用这句。",
    "重点不是“我担心”，而是“客观上存在风险”；所以常见于天气、系统、药物、制度这类场景。",
    "接续上最常见两种：`V辞書形 + 恐れがある` 和 `Nの + 恐れがある`；后者在灾害、故障、违规提醒里特别高频。",
    "公告里经常写成更平滑的 `おそれがあります`；换成全假名，语感不变，只是更像公文和说明文字面。",
    "想说“某人这种做法搞不好会干出坏事”，更像 `かねない`；想说“局面本身已经有风险”，更像 `恐れがある`。"
  ],
  "contrasts": [
    {
      "other_entry_id": "n2_045_kanenai",
      "title": "恐れがある vs かねない",
      "self_label": "客观风险已成立",
      "other_label": "主体可能做出危险举动",
      "difference": "`恐れがある` 像风险评估或公告，先把坏结果作为“客观危险”指出来；`かねない` 更像盯着某个人或某种做法，说“这样下去他真可能干出坏事”。",
      "example_self": {
        "jp_ruby": "安全[あんぜん]確認[かくにん]を省[はぶ]くと、重大[じゅうだい]な事故[じこ]が起[お]こる恐[おそ]れがある。",
        "zh": "如果省掉安全确认，就有发生重大事故的风险。",
        "note": "先看客观后果。"
      },
      "example_other": {
        "jp_ruby": "あの会社[かいしゃ]は、納期[のうき]を優先[ゆうせん]して安全[あんぜん]確認[かくにん]を省[はぶ]きかねない。",
        "zh": "那家公司可能会为了赶交期，连安全确认都省掉。",
        "note": "先看谁可能这么做。"
      },
      "exam_handle": "如果空格所在句像通知、说明、报告，重点是“会发生什么坏结果”，优先选 `恐れがある`；如果句子在盯某人某组织的做法，意思是“这种人搞不好会……”，优先选 `かねない`。"
    },
    {
      "other_entry_id": "n2_028_hatashite",
      "title": "恐れがある vs 果たして",
      "self_label": "已经能发出风险警报",
      "other_label": "结果到底会不会那样",
      "difference": "`恐れがある` 是“危险存在”；`果たして` 是“结果未定，我盯着看”。一个偏预警，一个偏悬念和追问。",
      "example_self": {
        "jp_ruby": "台風[たいふう]の進路[しんろ]によっては、試合[しあい]が中止[ちゅうし]になる恐[おそ]れがある。",
        "zh": "根据台风路径，比赛有可能被取消。",
        "note": "先把风险摆出来。"
      },
      "example_other": {
        "jp_ruby": "台風[たいふう]はそれるらしいけど、果[は]たして試合[しあい]は予定[よてい]どおり行[おこな]われるだろうか。",
        "zh": "听说台风可能会偏离，但比赛究竟能不能按计划进行呢？",
        "note": "镜头转向结果是否成真。"
      },
      "exam_handle": "如果空格后面是在追问“到底会不会、究竟怎样”，尤其带 `だろうか`、`のか` 之类，选 `果たして`；如果句子是在发出客观风险提示，选 `恐れがある`。"
    },
    {
      "other_entry_id": "n2_045_kanenai",
      "title": "恐れがある vs かねない",
      "self_label": "公告式风险提示",
      "other_label": "对人行为的警戒",
      "difference": "`恐れがある` 常见于系统公告、规章说明，语气硬而客观；`かねない` 更像口头提醒或批评，带“你这样会闯祸”的人味。",
      "example_self": {
        "jp_ruby": "この設定[せってい]のまま公開[こうかい]すると、個人情報[こじんじょうほう]が外部[がいぶ]に流出[りゅうしゅつ]する恐[おそ]れがあります。",
        "zh": "如果按这个设置直接公开，个人信息有外泄风险。",
        "note": "像系统或管理员提示。"
      },
      "example_other": {
        "jp_ruby": "そんな設定[せってい]のまま公開[こうかい]したら、また個人情報[こじんじょうほう]を漏[も]らしかねません。",
        "zh": "你要是照这个设置公开，又可能把个人信息泄露出去。",
        "note": "像同事当面提醒你。"
      },
      "exam_handle": "题干如果像公告、说明文、通知文，空格前多是条件或状态，优先想 `恐れがある`；如果像在提醒某个人“你这样会出事”，优先想 `かねない`。"
    }
  ],
  "memory_chain": "`かねない` 是看见人或做法正在往危险那边滑：再这样下去，真可能闯祸；`恐れがある` 是红灯已经亮起，风险被正式说出来；到了 `果たして`，镜头再往后推，去看结果究竟会不会真的变成那样。把它们连成“苗头 -> 风险 -> 悬念”，这一家族就会很好记。"
}