{
  "entry_id": "n4_060_nikui",
  "card_blurb": "把“难”说成一种操作手感：不是做不到，而是做起来卡、别扭、不顺。",
  "feel": "这句听起来像你已经上手去做了，但手感一直不对：按钮太小、字太密、纸太滑、说明太绕。事情不是完全不能完成，只是每一步都让人皱一下眉。",
  "family_position": "它站在这个家族里“手感上的难做”这一格。前面的 `ことができる` / `ようになる` 先回答会不会、能不能做到，`ようにする` 是有没有刻意去养成；到了 `やすい`、`にくい`、`づらい`，焦点就变成“做起来顺不顺”。其中 `にくい` 比 `づらい` 更偏客观，更像工具、设计、材质、表达方式本身让动作不顺。",
  "scene_paragraph": "打工报名快截止了，你在电车上掏出手机临时填表，页面一缩放就乱跳，输入栏又细又长，按了半天还是老点错。你不是不会填，也不是不能提交，只是每一步都卡手、费劲、让人想叹气。这时候最自然的说法就是 `にくい`：它说的不是“不能”，而是“做得到，但做起来真不顺”。",
  "scene_examples": [
    {
      "tag": "手机填表",
      "jp_ruby": "このフォーム、スマホだと入[にゅう]力[りょく]しにくいですね。",
      "zh": "这个表格用手机不太好填。",
      "note": "不是填不了，而是页面设计让操作很卡。"
    },
    {
      "tag": "听老师讲解",
      "jp_ruby": "先[せん]生[せい]の説[せつ]明[めい]、例[れい]が少[すく]なくてちょっと分[わ]かりにくかったです。",
      "zh": "老师的说明例子太少了，有点不太好懂。",
      "note": "`分かりにくい` 很常见，连“难理解”也能这样说。"
    },
    {
      "tag": "在纸上写字",
      "jp_ruby": "この紙[かみ]、つるつるしていてペンで書[か]きにくい。",
      "zh": "这张纸太滑了，用笔不太好写。",
      "note": "材料本身让动作不顺，是 `にくい` 的典型场景。"
    }
  ],
  "formula": "Vます形（去掉ます） + にくい",
  "formula_explainer": "把动词变成ます形，再去掉 `ます`，后面接 `にくい`。比如 `使います → 使いにくい`，`読みます → 読みにくい`，`分かります → 分かりにくい`。核心不是能力有没有，而是动作进行起来顺不顺、卡不卡。它也很常变成过去式或连接式，比如 `使いにくかった`、`使いにくくて`、`使いにくくなる`。",
  "structure_cards": [
    {
      "label": "基本：对象 + は + Vにくい",
      "note": "先点出“什么东西/什么事”让你觉得不顺手。",
      "jp_ruby": "このアプリはメニューが多[おお]くて使[つか]いにくい。",
      "zh": "这个应用菜单太多，不太好用。",
      "mini_note": "最基础的评语句型，像在给东西下使用感结论。"
    },
    {
      "label": "原因先行：〜て、Vにくい",
      "note": "前面先说造成困难的原因，后面再落到“难做”。",
      "jp_ruby": "字[じ]が小[ちい]さくて、この案[あん]内[ない]は読[よ]みにくい。",
      "zh": "字太小了，这份通知不太好读。",
      "mini_note": "`〜て` 常把“为什么难”直接交代清楚。"
    },
    {
      "label": "变化：Vにくくなる",
      "note": "表示在某种条件下，事情变得更难做。",
      "jp_ruby": "雨[あめ]の日[ひ]は、この靴[くつ]だと階[かい]段[だん]が歩[ある]きにくくなる。",
      "zh": "下雨天穿这双鞋时，上楼梯会变得不太好走。",
      "mini_note": "不仅能说“现在难”，也能说“变得难”。"
    }
  ],
  "usage_points": [
    "`にくい` 接在动词ます形前面，最常见的是 `読みにくい`、`書きにくい`、`使いにくい`、`分かりにくい` 这种高频搭配。",
    "它默认前提往往是“并非完全做不到”，而是能做，只是费劲、卡手、效率低。",
    "前面常常会带一个很具体的客观原因，比如字小、按钮硬、表格挤、说法绕、表面太滑。",
    "它特别适合描述“看、听、读、写、用、懂”这类有明显操作感或感受感的动作。",
    "口语里常配 `ちょっと` 来把语气放软，比如 `ちょっと分かりにくいです`，听起来更像礼貌反馈。",
    "如果难点主要来自尴尬、顾虑、人际压力，日语里往往会改用 `づらい`，因为那种“难”更偏心理。"
  ],
  "contrasts": [
    {
      "other_entry_id": "n4_121_yasui",
      "title": "にくい vs やすい",
      "self_label": "做起来卡、不顺手",
      "other_label": "做起来顺、容易上手",
      "difference": "这两个是最直接的一组反义搭档。`やすい` 是动作展开得很顺，`にくい` 是动作能做但老是卡。看题时先别急着翻成“容易/难”，先想句子是在夸手感，还是在抱怨手感。",
      "example_self": {
        "jp_ruby": "この説[せつ]明[めい]は言[い]い回[まわ]しが固[かた]くて分[わ]かりにくい。",
        "zh": "这份说明说法太生硬了，不太好懂。",
        "note": "信息能看完，但理解不顺。"
      },
      "example_other": {
        "jp_ruby": "この説[せつ]明[めい]は例[れい]が多[おお]くて分[わ]かりやすい。",
        "zh": "这份说明例子很多，很好懂。",
        "note": "同样是说明，换成顺手的一面就是 `やすい`。"
      },
      "exam_handle": "如果前面给的是“字小、步骤多、说法绕、按钮挤”这类让动作变卡的线索，空格多半填 `にくい`；如果给的是“简单、清楚、例子多、设计顺”，就往 `やすい` 想。"
    },
    {
      "other_entry_id": "n4_132_zurai",
      "title": "にくい vs づらい",
      "self_label": "客观上不好做",
      "other_label": "心理上不好做",
      "difference": "两者都能译成“难做”，但 `にくい` 更像东西本身、环境本身让你不顺手；`づらい` 更像气氛、关系、情绪让你不好意思、不容易开口。一个偏功能阻力，一个偏心理阻力。",
      "example_self": {
        "jp_ruby": "このマスクだと声[こえ]がこもって話[はな]しにくい。",
        "zh": "戴着这个口罩声音闷住了，不太好说话。",
        "note": "难点来自物理条件。"
      },
      "example_other": {
        "jp_ruby": "こんな雰[ふん]囲[い]気[き]だと本[ほん]音[ね]が話[はな]しづらい。",
        "zh": "这种气氛下，很难把真心话说出来。",
        "note": "难点来自气氛和心理顾虑。"
      },
      "exam_handle": "看障碍来自哪里。要是“字小、路滑、声音闷、设计差”，偏 `にくい`；要是“尴尬、不好意思、怕得罪人、关系微妙”，偏 `づらい`。"
    },
    {
      "other_entry_id": "n4_036_koto_ga_dekiru",
      "title": "にくい vs ことができる",
      "self_label": "难做，但并非不能做",
      "other_label": "能不能做",
      "difference": "`ことができる` 先回答“能力/可能性有没有”；`にくい` 则是在“能做”的前提里，继续补一句“但是做起来很不顺”。一个是有无判断，一个是手感评价。",
      "example_self": {
        "jp_ruby": "字[じ]が小[ちい]さくて読[よ]みにくいですが、拡[かく]大[だい]すれば読[よ]めます。",
        "zh": "字很小，不太好读，不过放大之后还是能读。",
        "note": "重点是“难读”，不是“不能读”。"
      },
      "example_other": {
        "jp_ruby": "小[ちい]さい字[じ]でも、拡[かく]大[だい]すれば読[よ]むことができます。",
        "zh": "就算字小，放大以后也能读。",
        "note": "这里只在说“可不可以做到”。"
      },
      "exam_handle": "如果句子里有“けど”“でも”“何とか”“放大就行”这种转折，常常是在说“虽能做但难”，往 `にくい` 想；如果只是单纯问有没有能力、有没有可能，往 `ことができる` 想。"
    }
  ],
  "memory_chain": "把这一家人串起来记：先用 `ことができる` 看“会不会”；再用 `ようになる` 看“有没有练到会”；用 `ようにする` 看“有没有刻意去做”；到了 `やすい` / `にくい` / `づらい`，就进入“做起来是什么手感”。其中 `やすい` 是顺手，`にくい` 是客观上卡手、不顺，`づらい` 是心理上别扭、难开口。这样一排下来，`にくい` 就不会是孤零零的“难”，而是家族里专门负责“难做手感”的那一格。"
}