{
  "entry_id": "n4_109_to_ittemo_ii",
  "card_blurb": "不是单纯“我觉得”，而是看着证据点点头说：这么讲，已经差不多成立了。",
  "feel": "这句听起来像你已经看了很多事实，不想下得太死，却也觉得“再谦虚就过头了”，于是补一句“这么说也可以”。",
  "family_position": "它站在这组“引用・说法出口”里最像“温和定性”的那一格：比「と思う」更往结论那边走，比「という」更不是在介绍名字，而是在说“把它算成这样也不夸张”。",
  "scene_paragraph": "朋友们看着社团里那个总是最早到、最晚走、还会主动带新人的学长。你不会突然很正式地下定义说“他就是教练”，但你很可能会笑着说一句：『もう先生と言ってもいいね。』这就是「と言ってもいい」的味道。前面是一串大家都看得到的事实，后面不是硬邦邦宣布结论，而是留一点余地地说：“这么讲，已经很接近了。”",
  "scene_examples": [
    {
      "tag": "运动习惯",
      "jp_ruby": "毎日[まいにち]朝[あさ]も夜[よる]も走[はし]っているし、彼[かれ]はもうマラソン選手[せんしゅ]と言[い]ってもいいね。",
      "zh": "他每天早晚都在跑，已经可以说是马拉松选手了。",
      "note": "看到持续积累的事实后，给出一个很接近结论的评价。"
    },
    {
      "tag": "找房聊天",
      "jp_ruby": "駅[えき]まで五分[ごふん]で、スーパーも病院[びょういん]も近[ちか]いし、この部屋[へや]は理想的[りそうてき]だと言[い]ってもいい。",
      "zh": "离车站五分钟，超市和医院也都近，这房子可以说很理想了。",
      "note": "很适合用在“列完条件后收一个总评价”的场景。"
    },
    {
      "tag": "天气感叹",
      "jp_ruby": "四月[しがつ]なのに三十度[さんじゅうど]もあるなんて、もう夏[なつ]と言[い]ってもいいですね。",
      "zh": "明明才四月却已经三十度，简直都可以说是夏天了。",
      "note": "日常闲聊里很自然，带一点夸张，但大家都能接受。"
    }
  ],
  "formula": "普通形 + と言ってもいい ／ 名詞・ナA + だ + と言ってもいい",
  "formula_explainer": "前面放一个完整判断，后面用「と言ってもいい」把它收成“这种说法成立”。名词和ナ形容词前常见「だ」，所以像「プロだと言ってもいい」「便利だと言ってもいい」。",
  "structure_cards": [
    {
      "label": "名词定性",
      "note": "先摆事实，再给人或事一个不算夸张的名词判断。",
      "jp_ruby": "彼[かれ]はこの店[みせ]の顔[かお]だと言[い]ってもいい。",
      "zh": "他可以说就是这家店的招牌。",
      "mini_note": "名词前常见「だ」。"
    },
    {
      "label": "状态评价",
      "note": "把前面的条件或情况，收成一个温和但偏肯定的评价。",
      "jp_ruby": "この値段[ねだん]なら、安[やす]いと言[い]ってもいい。",
      "zh": "这个价格的话，可以说便宜。",
      "mini_note": "语感像“这么说不算夸张”。"
    },
    {
      "label": "くらい扩张",
      "note": "常见成「〜と言ってもいいくらい」，表示程度已经很接近那个说法。",
      "jp_ruby": "彼[かれ]は日本人[にほんじん]と言[い]ってもいいくらい発音[はつおん]が自然[しぜん]だ。",
      "zh": "他的发音自然到都可以说像日本人。",
      "mini_note": "这是口语里很高频的变体。"
    }
  ],
  "usage_points": [
    "「と言ってもいい」不是单纯转述别人说的话，而是说话人自己把前面的内容整理成一种“可以这样说”的判断。",
    "它通常出现在“依据已经不少”的场景里，所以比「と思う」更有把握，更像在给人事物贴一个标签。",
    "它又没有硬到绝对断言，始终留一点余地；中文常像“可以说……了”“这么说也不为过”。",
    "名词、ナ形容词前常见「だと言ってもいい」；动词和イ形容词则直接接普通形，如「勝[か]ったと言ってもいい」「安いと言ってもいい」。",
    "很常和「もう」「ほとんど」「〜くらい」这类词一起出现，表示“已经接近那个定义了”。",
    "适合夸人、总结印象、评价程度；如果是新闻播报或正式公告，这个说法会显得太主观。"
  ],
  "contrasts": [
    {
      "other_entry_id": "n4_114_to_omou",
      "title": "と言ってもいい vs と思う",
      "self_label": "这么说已经八九不离十",
      "other_label": "只是表达我的想法",
      "difference": "「と言ってもいい」是根据现成事实给出“这样定性也成立”的判断；「と思う」则把结论留在“我觉得”。",
      "example_self": {
        "jp_ruby": "この点数[てんすう]なら、もう受[う]かったと言[い]ってもいい。",
        "zh": "这个分数的话，已经可以说是过了。",
        "note": "说话人几乎把结论落下来了。"
      },
      "example_other": {
        "jp_ruby": "この点数[てんすう]なら、受[う]かったと思[おも]う。",
        "zh": "这个分数的话，我觉得是过了。",
        "note": "还是停在个人判断上。"
      },
      "exam_handle": "看到前面已经给了依据，空格又是在收一个“可以这么说”的结论时，优先想「と言ってもいい」；如果只是“我觉得”，选「と思う」。"
    },
    {
      "other_entry_id": "n4_110_to_iu",
      "title": "と言ってもいい vs という",
      "self_label": "评价这个标签成立",
      "other_label": "说明这个名字或称呼本身",
      "difference": "「という」是在介绍名字、称呼或内容；「と言ってもいい」是在判断“把它叫成这样也不夸张”。",
      "example_self": {
        "jp_ruby": "この店[みせ]はカフェと言[い]ってもいい。食事[しょくじ]よりコーヒーが中心[ちゅうしん]だから。",
        "zh": "这家店可以说就是咖啡馆，因为比起吃饭更以咖啡为主。",
        "note": "重点是“这样称呼它很合理”。"
      },
      "example_other": {
        "jp_ruby": "これは「森[もり]のカフェ」という店[みせ]です。",
        "zh": "这是一家叫“森林咖啡馆”的店。",
        "note": "重点只是介绍名字。"
      },
      "exam_handle": "如果空格处是在接名字、标题、内容，或后面还要继续修饰名词，常是「という」；如果意思是“算成这样也行”，选「と言ってもいい」。"
    },
    {
      "other_entry_id": "n4_026_ka_dou_ka",
      "title": "と言ってもいい vs かどうか",
      "self_label": "已经愿意给出定性",
      "other_label": "还停在是否成立",
      "difference": "「と言ってもいい」是往结论走，觉得“可以这么说了”；「かどうか」则把整句包进“是否”里，先不下判断。",
      "example_self": {
        "jp_ruby": "毎日[まいにち]練習[れんしゅう]しているし、もうプロと言[い]ってもいい。",
        "zh": "他每天都在练，已经可以说是职业级了。",
        "note": "说话人已经站到结论这边。"
      },
      "example_other": {
        "jp_ruby": "彼[かれ]がプロかどうかは、まだ分[わ]からない。",
        "zh": "他算不算职业选手，还不知道。",
        "note": "把问题装起来，暂时不判断。"
      },
      "exam_handle": "如果空格后面连着「分からない」「知りたい」「確認する」这类“先判断是否”的内容，常是「かどうか」；如果是在收尾评价“都可以说是……了”，选「と言ってもいい」。"
    }
  ],
  "memory_chain": "先记「という」是给名字或内容挂标签，口语里会缩成「って」；再到「と思う」，是把整句送进“我觉得”；「と言ってもいい」则再往前半步，不只是想，而是觉得“这么说已经成立了”；如果还不想定性，就退回「かどうか」，只把整句包成“是否如此”。"
}