{
  "entry_id": "n4_042_mama",
  "card_blurb": "`まま`像把画面按下暂停：门开着就开着，衣服穿着就穿着，没做的事也就那样搁着。重点不是“发生了什么”，而是“那个状态没被改动”。",
  "feel": "这句听起来像说话人指着眼前的样子说：对，就这样，先别动。后面的事，都是带着这个原封不动的状态继续发生的。",
  "family_position": "它在“状态・结果操作系”里站的是“保持原样”这一格。`他動詞/自動詞`看状态怎么变，`にする`、`くする`是把状态改过去，`まま`则是偏偏不改，让那个结果停在那儿。",
  "scene_paragraph": "早上赶着出门，朋友刚穿好鞋又回头一看：灯还亮着，空调还开着，桌上的咖啡也是拆了没喝。这个时候最自然就会冒出 `まま`。它特别像生活里那些“来不及收回去”的状态：不是在讲谁做了什么，而是在讲那个样子一直没变，所以才有后面的麻烦、方便，或者一点点无奈。",
  "scene_examples": [
    {
      "tag": "赶着出门",
      "jp_ruby": "エアコンをつけたまま出[で]ちゃった。",
      "zh": "我空调开着就出门了。",
      "note": "典型 `Vた + まま`，动作做完后，结果状态一直留着。"
    },
    {
      "tag": "消息没回",
      "jp_ruby": "彼[かれ]に返事[へんじ]しないまま、もう三日[みっか]たってる。",
      "zh": "一直没回他消息，已经过了三天。",
      "note": "`Vない + まま` 常带“该做却没做，就这么拖着”的感觉。"
    },
    {
      "tag": "店里确认",
      "jp_ruby": "箱[はこ]のままで大丈夫[だいじょうぶ]ですか。それとも開[あ]けますか。",
      "zh": "保持箱子原样可以吗？还是要打开？",
      "note": "`Nの + まま` 很适合说包装、形式、摆放方式都不改。"
    }
  ],
  "formula": "`Vた + まま` / `Vない + まま` / `Nの + まま` / `イAい + まま` / `ナAな + まま`",
  "formula_explainer": "`まま`接在“状态”后面，说的是那个状态维持不变。`Vた` 多半是“做了以后一直那样”，`Vない` 多半是“没做就那样放着”。",
  "structure_cards": [
    {
      "label": "动作做完，状态留下",
      "note": "最常见，适合会留下明显结果的动词。",
      "jp_ruby": "窓[まど]を開[あ]けたまま、会議[かいぎ]を始[はじ]めないで。",
      "zh": "别开着窗就开始开会。",
      "mini_note": "关注点是“窗户一直开着”，不是“开了窗”这个动作本身。"
    },
    {
      "label": "该做没做，直接进入下一步",
      "note": "常见于忘记、偷懒、来不及。",
      "jp_ruby": "朝[あさ]ごはんを食[た]べないまま、駅[えき]まで走[はし]った。",
      "zh": "没吃早饭就一路跑到车站。",
      "mini_note": "有一种“空着这一格往下推进”的语感。"
    },
    {
      "label": "保持外形或条件不变",
      "note": "名词和 `そのまま` 都很高频。",
      "jp_ruby": "この写真[しゃしん]、加工[かこう]しないでそのまま使[つか]いたいです。",
      "zh": "这张照片我想不要加工，直接原样用。",
      "mini_note": "`そのまま` 就是口语里非常常见的“就照现在这样”。"
    }
  ],
  "usage_points": [
    "`まま`抓的是“状态没变”，所以特别爱和会留下结果的词搭配，比如 `開ける`、`つける`、`着る`、`置く`。",
    "`Vたまま` 不等于单纯“做了以后”。如果后面不强调“那个结果还保持着”，就不一定要用 `まま`。",
    "`Vないまま` 往往比普通否定更有“遗漏、拖着、没补上”的感觉，所以很常出现在后悔、解释、抱怨里。",
    "句尾说 `〜ままだ` / `〜ままです` 时，重心是“仍然保持那个状态”；接后续动作时，重心是“带着那个状态去做别的事”。",
    "`このまま`、`そのまま`、`あのまま` 都很常用，先把这几个整体记住，会比只背公式更有语感。"
  ],
  "contrasts": [
    {
      "other_entry_id": "n4_039_ku_suru",
      "title": "まま vs くする",
      "self_label": "保持现成状态",
      "other_label": "主动把状态改成那样",
      "difference": "`まま` 是“已经这样了，就让它继续这样”；`くする` 是“现在还没那样，我去把它弄成那样”。",
      "example_self": {
        "jp_ruby": "部屋[へや]は暗[くら]いままでいいよ。すぐ戻[もど]るから。",
        "zh": "房间就保持暗着吧，我马上回来。",
        "note": "房间已经暗，重点是别去改。"
      },
      "example_other": {
        "jp_ruby": "部屋[へや]を少[すこ]し暗[くら]くして。まぶしい。",
        "zh": "把房间调暗一点，太刺眼了。",
        "note": "现在要动手改变亮度。"
      },
      "exam_handle": "空格前如果已经给了现成状态，意思是“别动它”，优先想 `まま`；如果句子是在下指令或做决定去改变程度，选 `くする`。"
    },
    {
      "other_entry_id": "n4_059_ni_suru",
      "title": "まま vs にする",
      "self_label": "保留原案原样",
      "other_label": "决定改成新结果",
      "difference": "`まま` 是接受当前状态继续用；`にする` 是拍板，把结果设成另一个样子。",
      "example_self": {
        "jp_ruby": "値段[ねだん]は今[いま]のままでいいです。急[きゅう]に変[か]えなくて。",
        "zh": "价格维持现在这样就行，不用急着改。",
        "note": "重点是维持原方案。"
      },
      "example_other": {
        "jp_ruby": "値段[ねだん]は三千円[さんぜんえん]にします。",
        "zh": "价格就定成三千日元。",
        "note": "重点是把结果定到新数值。"
      },
      "exam_handle": "题目如果在说“保持现在这样”，常见 `今のまま`、`このまま`；如果是在做选择、设定、决定结果，多半是 `にする`。"
    },
    {
      "other_entry_id": "n4_086_tadoushi_jidoushi",
      "title": "まま vs 他動詞 & 自動詞",
      "self_label": "盯住变化后的状态还留着",
      "other_label": "先交代状态怎么发生变化",
      "difference": "`他動詞/自動詞` 先说“开了、关了、谁弄的”；`まま` 不追动作来源，而是把镜头停在结果状态上。",
      "example_self": {
        "jp_ruby": "窓[まど]が開[あ]いたままだから、寒[さむ]いね。",
        "zh": "窗户一直开着，所以很冷啊。",
        "note": "不是在追问谁开的，而是在说“开着”这个状态还在。"
      },
      "example_other": {
        "jp_ruby": "だれかが窓[まど]を開[あ]けたから、寒[さむ]いね。",
        "zh": "因为有人把窗户打开了，所以很冷啊。",
        "note": "这里先交代变化是怎么来的。"
      },
      "exam_handle": "空格要是放在前项后面，想表达“保持那个样子”，选 `まま`；要是题目在考“谁开了、门自己开了”这类变化关系，就去找他动词或自动词。"
    }
  ],
  "memory_chain": "这一家族可以这样串起来记：先看东西“从什么做出来”（`から作る`），再看状态“是谁让它变、还是自己变”（`他動詞 / 自動詞`），再学会“主动把它改成什么样”（`にする`、`くする`），最后补上 `まま`：有时候真正关键的不是改变，而是那个结果被原封不动地保留下来。"
}