{
  "entry_id": "n5_019_itsumo",
  "card_blurb": "「いつも」不是冷冰冰的“永远”，更像一句生活观察：这个人平时就这样，这事常常就这么发生。",
  "feel": "听起来像把很多次相似的小画面叠成一张“习惯照片”。说话人不是在精确计数，而是在说“这就是他的默认模式”。",
  "family_position": "它在这个家族里不切“前后”，也不判“已经/还没”；它站在时间线的上方，专门给一连串重复出现的动作贴上“平时都这样”的频率标签。",
  "scene_paragraph": "早上的车站口，你朋友又拿着同一家店的咖啡出现，店员甚至已经记住他的口味。你笑着说一句「いつもこれだね」。这时你不是在说“今天这一杯”，而是在抓他反复出现的固定选择。放回本家族里看，`とき`、`前に`、`てから` 是把时间点和顺序切清楚，`いつも` 则告诉你：这样的画面不是一次，是常态。",
  "scene_examples": [
    {
      "tag": "通勤路线",
      "jp_ruby": "彼[かれ]はいつも駅前[えきまえ]の店[みせ]でコーヒーを買[か]ってから、会社[かいしゃ]へ行[い]きます。",
      "zh": "他总会先在车站前那家店买咖啡，再去公司。",
      "note": "把固定路线里的默认动作说出来了。"
    },
    {
      "tag": "点餐习惯",
      "jp_ruby": "この店[みせ]に来[く]ると、友[とも]だちはいつも同[おな]じカレーを頼[たの]みます。",
      "zh": "朋友来这家店时，总是点同一份咖喱。",
      "note": "重点不是这一单，而是他一贯的选择。"
    },
    {
      "tag": "带点抱怨",
      "jp_ruby": "弟[おとうと]はいつも出[で]る前[まえ]に「かぎ、どこ？」って言[い]うんです。",
      "zh": "弟弟每次出门前都会来一句“钥匙呢？”。",
      "note": "语气一变，`いつも` 也很容易带出“你老是这样”的小抱怨。"
    }
  ],
  "formula": "Aは + いつも + V / 条件 + と、Aはいつも + V",
  "formula_explainer": "`いつも` 是副词，最常见的位置是在话题后、动词前。你可以把它理解成给整个动作盖章：这不是偶然一次，而是平时的默认发生方式。",
  "structure_cards": [
    {
      "label": "人は いつも V",
      "note": "最基础的骨架，直接说人的固定习惯。",
      "jp_ruby": "私[わたし]はいつも六[ろく]時[じ]に起[お]きます。",
      "zh": "我平时总是六点起床。",
      "mini_note": "最稳的 N5 句型，先记这一格。"
    },
    {
      "label": "条件 + と、いつも V",
      "note": "一进某个场景，就总会出现同样的反应。",
      "jp_ruby": "この音[おと]を聞[き]くと、猫[ねこ]はいつも台所[だいどころ]へ来[き]ます。",
      "zh": "一听到这个声音，猫总会跑到厨房来。",
      "mini_note": "很适合讲“触发条件一出现，就老是这样”。"
    },
    {
      "label": "前に/てから + いつも V",
      "note": "和家族邻居连用，把“顺序”和“习惯”一起说清。",
      "jp_ruby": "父[ちち]は朝[あさ]ご飯[はん]を食[た]べてから、いつも新聞[しんぶん]を読[よ]みます。",
      "zh": "爸爸吃完早饭后，总会看报纸。",
      "mini_note": "`てから` 管前后，`いつも` 管这套顺序是不是天天都这样。"
    }
  ],
  "usage_points": [
    "`いつも` 常译成“总是/平时都”，但口语里不一定是数学上的 100%；更多是在说“这很像他的固定模式”。",
    "它可以是中性观察，也可以带夸奖或抱怨，具体色彩常常靠语气和上下文决定。",
    "最安全的位置是“话题 + は + いつも + 动词”。初学阶段先用这个骨架，几乎不会错。",
    "它不只修饰动作，也常修饰选择和状态，比如“总点同一道菜”“总坐同一个位子”。",
    "如果句子在追问“已经了吗”“还没吗”，就不是 `いつも` 的地盘，而是 `もう / まだ / まだ〜ていません` 的地盘。",
    "只发生一次、临时起意的事一般不配 `いつも`；一放进去，听感就会变成“这是惯例”。"
  ],
  "contrasts": [
    {
      "other_entry_id": "n5_035_mou",
      "title": "いつも vs もう",
      "self_label": "平时的默认习惯",
      "other_label": "这一次已经完成",
      "difference": "`いつも` 把很多次相似行为打包成习惯；`もう` 盯的是这一次的进度，意思是“已经到这一步了”。",
      "example_self": {
        "jp_ruby": "昼[ひる]はいつもこの店[みせ]で食[た]べます。",
        "zh": "中午我平时都在这家店吃。",
        "note": "说的是长期习惯。"
      },
      "example_other": {
        "jp_ruby": "昼[ひる]ご飯[はん]はもうこの店[みせ]で食[た]べました。",
        "zh": "午饭已经在这家店吃过了。",
        "note": "说的是这一次已经完成。"
      },
      "exam_handle": "题干如果在问“平时怎样”，或前后都是日常描写，优先想 `いつも`；如果在问“已经做了没”，看完成进度，选 `もう`。"
    },
    {
      "other_entry_id": "n5_028_mada_te_imasen",
      "title": "いつも vs まだ〜ていません",
      "self_label": "讲习惯节奏",
      "other_label": "讲现在还没做",
      "difference": "`いつも` 看重复频率，`まだ〜ていません` 看动作到现在还没发生。一个是“常常如此”，一个是“目前未完成”。",
      "example_self": {
        "jp_ruby": "山田[やまだ]さんはレポートをいつも金曜日[きんようび]に出[だ]します。",
        "zh": "山田一般都在星期五交报告。",
        "note": "交报告的固定节奏。"
      },
      "example_other": {
        "jp_ruby": "山田[やまだ]さんはレポートをまだ出[だ]していません。",
        "zh": "山田还没有交报告。",
        "note": "盯的是这一份报告现在的状态。"
      },
      "exam_handle": "空格后如果常跟 `ていません`，几乎就在考“还没”这一格；如果句子在描写某人的做事习惯，选 `いつも`。"
    },
    {
      "other_entry_id": "n5_071_te_kara",
      "title": "いつも vs てから",
      "self_label": "给动作加“每次都这样”",
      "other_label": "给动作排先后顺序",
      "difference": "`いつも` 不负责排 A、B 谁先谁后，只负责说这个模式反复出现；`てから` 明确告诉你“先 A，后 B”。",
      "example_self": {
        "jp_ruby": "父[ちち]は朝[あさ]、いつも新聞[しんぶん]を読[よ]みます。",
        "zh": "爸爸早上总会看报纸。",
        "note": "只有习惯感，没有强调顺序。"
      },
      "example_other": {
        "jp_ruby": "父[ちち]は朝[あさ]ご飯[はん]を食[た]べてから、新聞[しんぶん]を読[よ]みます。",
        "zh": "爸爸吃完早饭后再看报纸。",
        "note": "重点变成先后次序。"
      },
      "exam_handle": "看到空格前后有两个动作要排顺序，就先想 `てから`；只有一个动作，想表达“平时都这样”，再选 `いつも`。"
    }
  ],
  "memory_chain": "先用 `とき` 找到画面发生的点，用 `前に` / `てから` 排好前后，再看这个画面是不是 `いつも` 反复出现；最后再用 `もう` / `まだ` / `まだ〜ていません` 检查事情走到哪一步。记成一条线：什么时候 -> 先还是后 -> 平时常不常这样 -> 现在做到哪儿了。"
}