{
  "entry_id": "n2_188_yara_yara",
  "card_blurb": "把几样东西、动作或情绪随手摊开，说成“这个啦那个啦”，语气里常带杂多、忙乱或百感交集的现场感。",
  "feel": "像说话人边回想边往外倒：这个也有，那个也有，事情一股脑全来了。",
  "family_position": "它在“举例・换言系”里站在“散点列举”这一格：比「あるいは」不是二选一，而是并排冒出来；比「といった」也更口语、更乱、更像现场反应，还没整理成整齐的说明。",
  "scene_paragraph": "晚上十点，你问刚搬完家的朋友“总算收好了吧？”他苦笑着说，今天从拆箱到改地址再到找东西，一件接一件，根本没停过。这时候用「やら～やら」，不是在认真做清单，而是把压过来的几件事随手往桌上一摊，让人立刻听出“事情太多，根本说不完”的感觉。",
  "scene_examples": [
    {
      "tag": "搬家杂事",
      "jp_ruby": "引[ひ]っ越[こ]しの日[ひ]は、箱[はこ]を開[あ]けるやら住所[じゅうしょ]変更[へんこう]の手続[てつづ]きをするやらで、昼[ひる]ご飯[はん]を食[た]べる暇[ひま]もなかった。",
      "zh": "搬家那天又是拆箱又是办地址变更，连午饭都没空吃。",
      "note": "前面把杂事一件件抖出来，后面用结果句收住。"
    },
    {
      "tag": "突然被点名",
      "jp_ruby": "急[きゅう]に名前[なまえ]を呼[よ]ばれて、うれしいやら恥[は]ずかしいやらで、何[なに]を話[はな]したか覚[おぼ]えていない。",
      "zh": "突然被叫到名字，我又高兴又害羞，连自己说了什么都不记得了。",
      "note": "不只列事情，也常拿来并排摆出混在一起的心情。"
    },
    {
      "tag": "考前书桌",
      "jp_ruby": "机[つくえ]の上[うえ]には参考書[さんこうしょ]やらメモやらが散[ち]らかっていて、どこから手[て]をつければいいのか分[わ]からない。",
      "zh": "桌上参考书啦笔记啦摊得到处都是，我都不知道该从哪下手。",
      "note": "列名词时很有“这一堆那一堆”的画面感。"
    }
  ],
  "formula": "名詞 / 動詞辞書形 / イAい / ナA語幹 + やら + 名詞 / 動詞辞書形 / イAい / ナA語幹 + やら（で／が…）",
  "formula_explainer": "前面并列丢出两项，形式上写两个，语感上常暗示“还有别的”。后面常接结果、评价或整体印象，比如忙、乱、热闹、受不了、百感交集。",
  "structure_cards": [
    {
      "label": "名詞やら名詞やら",
      "note": "先把几样东西摊出来",
      "jp_ruby": "テーブルの上[うえ]には領収書[りょうしゅうしょ]やら名刺[めいし]やらが積[つ]み上[あ]がっている。",
      "zh": "桌上发票啦名片啦堆成一叠。",
      "mini_note": "最常见的形态，听起来像“这个啦那个啦”。"
    },
    {
      "label": "辞書形やら辞書形やらで〜",
      "note": "把同时发生的动作扫过去",
      "jp_ruby": "子[こ]どもたちは笑[わら]うやらふざけるやらで、写真[しゃしん]が全然[ぜんぜん]撮[と]れない。",
      "zh": "孩子们又笑又闹，根本拍不好照片。",
      "mini_note": "动作并列后，后面常接一个总体结果。"
    },
    {
      "label": "イAいやらイAいやらで〜",
      "note": "混合心情直接并排",
      "jp_ruby": "急[きゅう]にほめられて、うれしいやら恥[は]ずかしいやらで、返事[へんじ]が変[へん]になってしまった。",
      "zh": "突然被夸，我又高兴又害羞，连回答都变得怪怪的。",
      "mini_note": "这种用法不在分类，而在传达“心里一下子有好几种感觉”。"
    }
  ],
  "usage_points": [
    "它不是“把项目列完整”，而是随手点出几样代表项；听的人自然会补出“还有别的”。",
    "最顺的搭配是同类并列：东西配东西，动作配动作，心情配心情。这样句子会有成串冒出来的节奏。",
    "后面常接一个总结果或感想，比如「〜で大変だった」「〜で落ち着かない」「〜が次々出た」。前面是材料，后面才是落点。",
    "语气比「といった」更口语，也更带说话人的卷入感。忙乱、热闹、狼狈、百感交集时特别常见。",
    "它不只写现实事项，也常写混合心情，如「うれしいやら恥ずかしいやら」。重点不是分析情绪，而是传达“几种感觉一起涌上来”。",
    "如果你想写得整齐、客观、像说明文，通常别用它来做规整举例；那是「といった」更擅长的地盘。"
  ],
  "contrasts": [
    {
      "other_entry_id": "n2_167_to_itta",
      "title": "やら～やら vs といった",
      "self_label": "把几样东西随手摊开",
      "other_label": "挑几样代表例子来归类",
      "difference": "「やら～やら」像口语里边想边数“这个啦那个啦”，带杂多感；「といった」是把例子整理后递给对方，语气更整齐、更说明性。",
      "example_self": {
        "jp_ruby": "旅行[りょこう]の前[まえ]は、充電器[じゅうでんき]やら常備薬[じょうびやく]やらを詰[つ]めていたら、荷物[にもつ]がどんどん増[ふ]えた。",
        "zh": "出门前光是塞充电器啦常备药啦，行李就越装越多。",
        "note": "例子是随手往外冒的，重点是“东西一堆”。"
      },
      "example_other": {
        "jp_ruby": "旅行[りょこう]には、充電器[じゅうでんき]や常備薬[じょうびやく]といったものを忘[わす]れずに持[も]っていこう。",
        "zh": "旅行时，像充电器、常备药这类东西别忘了带。",
        "note": "是在整齐地列出代表例子。"
      },
      "exam_handle": "如果空格前后是在抱怨“这也要那也要”，A、B只是随手举几项，多半选「やら～やら」；如果是在说明“像A、B这类东西”，后面常接「もの」「例」，更像「といった」。"
    },
    {
      "other_entry_id": "n2_002_aruiwa",
      "title": "やら～やら vs あるいは",
      "self_label": "都在场，杂七杂八地并列",
      "other_label": "二选一，提出另一种可能",
      "difference": "「やら～やら」把多个项目一起摆出来，默认它们是并存的；「あるいは」是在选项之间做“或”的连接，强调替代关系，不是堆料感。",
      "example_self": {
        "jp_ruby": "日曜[にちよう]は洗濯[せんたく]やら掃除[そうじ]やらで、気[き]づいたら夕方[ゆうがた]だった。",
        "zh": "周日又洗衣又打扫，回过神来已经傍晚了。",
        "note": "两件事都发生了，而且还不止这两件的感觉。"
      },
      "example_other": {
        "jp_ruby": "日曜[にちよう]は洗濯[せんたく]あるいは掃除[そうじ]だけ済[す]ませて、午後[ごご]は休[やす]もう。",
        "zh": "周日把洗衣或打扫其中一件做完，下午就休息吧。",
        "note": "这里只是在选一个方案。"
      },
      "exam_handle": "先看语义是不是“都发生/都存在”。如果A、B一起压上来，用「やら～やら」；如果意思是“要么A要么B”，就抓「あるいは」。"
    },
    {
      "other_entry_id": "n2_195_you_suru_ni",
      "title": "やら～やら vs 要するに",
      "self_label": "先把细节摊开",
      "other_label": "把前文收成一句",
      "difference": "「やら～やら」负责把零散材料往外摆；「要するに」不再铺材料，而是把前面的信息压缩成结论。一个是展开，一个是收口。",
      "example_self": {
        "jp_ruby": "会議[かいぎ]では予算[よさん]の話[はなし]やら人手[ひとで]の話[はなし]やらが次々[つぎつぎ]に出[で]て、予定[よてい]どおりに進[すす]まなかった。",
        "zh": "会议上预算啦人手啦的问题一个接一个冒出来，完全没按计划进行。",
        "note": "镜头还停在“问题一堆”的展开状态。"
      },
      "example_other": {
        "jp_ruby": "会議[かいぎ]では問題[もんだい]がいろいろ出[で]た。要[よう]するに、人手[ひとで]も予算[よさん]も足[た]りないということだ。",
        "zh": "会议上冒出了各种问题。总之，就是人手和预算都不够。",
        "note": "把前面的信息直接收成一句结论。"
      },
      "exam_handle": "如果空格后面还在继续列材料、造出“这也那也”的堆叠感，用「やら～やら」；如果前文已经铺开，空格是在收束结论，就选「要するに」。"
    }
  ],
  "memory_chain": "把这一家串起来记：需要“或”的时候是「あるいは」；眼前材料一股脑冒出来时先用「やら～やら」摊开；想把这些例子整理成“比如A、B这类”时换成「といった」；再进一步给它贴标签，是「いわゆる」；顺着前文改说法，是「ということは」；最后把话收成一句，就是「要するに」。"
}