{
  "entry_id": "n2_189_yohodo_yoppodo",
  "card_blurb": "不是普通的“很”，而是“都到这份上了，难怪会这样”。",
  "feel": "这句听起来像：这得是相当……了吧，不然事情不会发展成这样。它不是平平地报一个高程度，而是带着说话人“普通程度解释不了”的判断。",
  "family_position": "它在这组“程度・分寸系”里站的是偏高、偏强的那一格。`わずかに` 是只动一点点，`一応` 是先够到线，`以上に` 是拿着某个基准往上比；到了 `よほど / よっぽど`，就已经是“明显超出常态”，常常让人顺手从结果倒推原因。",
  "scene_paragraph": "朋友平时消息回得很快，昨晚却一直失联，第二天才说自己回家倒头就睡。这个时候，你脑子里冒出来的往往不是冷冰冰的“他很累”，而是更贴近口气的“他昨天大概累得相当厉害吧”。`よほど / よっぽど` 就常出现在这种场景里：看到结果后，觉得普通程度根本解释不通。它也很常用来拉高门槛，比如“除非发生很特别的事，不然不会改”。",
  "scene_examples": [
    {
      "tag": "加班后失联",
      "jp_ruby": "昨日[きのう]はよほど疲[つか]れていたんだね。帰[かえ]ってすぐ寝[ね]ちゃって、連絡[れんらく]もできなかったんでしょう。",
      "zh": "你昨天是累得相当厉害吧。一回家就睡着了，连消息都没法回了。",
      "note": "看到“秒睡+失联”的结果，倒推原因。"
    },
    {
      "tag": "请假的门槛",
      "jp_ruby": "店長[てんちょう]は、よほどのことがない限[かぎ]り、当日[とうじつ]のシフト変更[へんこう]は認[みと]めないって言[い]ってた。",
      "zh": "店长说，除非是很特殊的情况，不然当天不接受调班。",
      "note": "高频用法就是把门槛抬高。"
    },
    {
      "tag": "比较里的惊讶",
      "jp_ruby": "有名店[ゆうめいてん]のって聞[き]いて期待[きたい]してたけど、駅前[えきまえ]のこのプリンのほうがよっぽどおいしい。",
      "zh": "本来听说那家是名店还挺期待的，但车站前这家布丁反而好吃多了。",
      "note": "放进比较里，差距感会更强。"
    }
  ],
  "formula": "よほど / よっぽど + 形容詞・動詞 | よほどの + 名詞 | よほど〜ない限り",
  "formula_explainer": "最常见是当副词，放在形容词、动词前面，表示“程度非常高，普通水平解释不了”；接名词时常用 `よほどのN`，尤其高频的是 `よほどのこと`。`よっぽど` 是更口语、更随口的说法。",
  "structure_cards": [
    {
      "label": "从结果倒推原因",
      "note": "看到异常结果，判断一定到了相当程度。",
      "jp_ruby": "彼[かれ]、会議[かいぎ]中[ちゅう]に居眠[いねむ]りしてたよ。よほど寝不足[ねぶそく]だったんだね。",
      "zh": "他开会时都打瞌睡了啊，看来真的是困得不轻。",
      "mini_note": "重点不是“困”，而是“困到这种地步”。"
    },
    {
      "label": "高门槛条件",
      "note": "表示“除非到很特殊的程度，不然不会”。",
      "jp_ruby": "よほどの理由[りゆう]がない限[かぎ]り、締[し]め切[き]りの延長[えんちょう]はできません。",
      "zh": "除非有相当充分的理由，否则不能延长截止日期。",
      "mini_note": "`よほどのN` 很常落在 `理由`、`こと` 前面。"
    },
    {
      "label": "比较里拉开差距",
      "note": "说的不只是“更”，而是“明显更”。",
      "jp_ruby": "今[いま]の職場[しょくば]も悪[わる]くないけど、前[まえ]の会社[かいしゃ]のほうがよっぽど気楽[きらく]だった。",
      "zh": "现在的职场也不差，但以前那家公司可轻松多了。",
      "mini_note": "口语里用 `よっぽど` 很顺，主观评价感强。"
    }
  ],
  "usage_points": [
    "它不是冷静报数值的“很”，而是带着说话人判断：事情已经到了非一般程度。",
    "特别常见于“先看到结果，再反推原因”的句子，如 `よほど疲れていたんだね`。",
    "接名词时多用 `よほどのN`，其中 `よほどのことがない限り` 是非常值得整块记住的高频表达。",
    "`よっぽど` 比 `よほど` 更口语、更像聊天时脱口而出；写作、说明、正式场合里 `よほど` 更稳。",
    "放进比较句时，语感接近“明显更……”“可比……强多了”，差距感比普通的 `もっと` 更有情绪。",
    "很多时候它还带一点惊讶、感叹，隐含“普通程度根本说不过去”。"
  ],
  "contrasts": [
    {
      "other_entry_id": "n2_029_ichiou",
      "title": "よほど / よっぽど vs 一応",
      "self_label": "程度高到超出常态",
      "other_label": "先做到一个起码程度",
      "difference": "`よほど / よっぽど` 把刻度拉高，常带“难怪会这样”的判断；`一応` 则是先过线、先交代一下，不强调强，而强调“姑且算有做到”。",
      "example_self": {
        "jp_ruby": "よほど準備[じゅんび]してきたのか、面接官[めんせつかん]の質問[しつもん]に一度[いちど]も詰[つ]まらなかった。",
        "zh": "他大概是准备得相当充分吧，面试官的问题一个都没卡住。",
        "note": "重点在“准备程度很高”。"
      },
      "example_other": {
        "jp_ruby": "一応[いちおう]、面接[めんせつ]で聞[き]かれそうなことは昨夜[さくや]確認[かくにん]してきました。",
        "zh": "我姑且把面试可能问到的内容昨晚先确认过了。",
        "note": "重点在“起码做过一点准备”。"
      },
      "exam_handle": "如果空格后面像是在解释一个显著结果，或有“难怪”“怪不得”的味道，优先想 `よほど / よっぽど`；如果句子只是交代“先做了、姑且有做”，选 `一応`。"
    },
    {
      "other_entry_id": "n2_186_wazuka_ni",
      "title": "よほど / よっぽど vs わずかに",
      "self_label": "量级拉得很高",
      "other_label": "只有一点点变化",
      "difference": "`よほど / よっぽど` 是大幅度、明显高；`わずかに` 则是极小幅度，像刻度只挪了一点。一个往上拧很多，一个只轻轻动一下。",
      "example_self": {
        "jp_ruby": "今日[きょう]は昨日[きのう]よりよっぽど寒[さむ]いね。手袋[てぶくろ]なしじゃ無理[むり]だよ。",
        "zh": "今天比昨天冷多了，不戴手套根本不行。",
        "note": "差距大，体感明显。"
      },
      "example_other": {
        "jp_ruby": "今日[きょう]は昨日[きのう]よりわずかに寒[さむ]いけど、コートは要[い]らないね。",
        "zh": "今天是比昨天稍微冷一点，不过还不用穿大衣。",
        "note": "差距小，几乎只是轻微变化。"
      },
      "exam_handle": "看到上下文在强调“差很多、明显不一样”，选 `よほど / よっぽど`；如果只是“略微、仅仅一点”，就该是 `わずかに`。"
    },
    {
      "other_entry_id": "n2_031_ijou_ni",
      "title": "よほど / よっぽど vs 以上に",
      "self_label": "主观上觉得高得超出常态或预想",
      "other_label": "明确拿某个基准来比，超过它",
      "difference": "`以上に` 心里一定有个参照物，语感是“比X更……”；`よほど / よっぽど` 不一定把基准说出来，更像说话人直接判断“这程度已经很不一般”。",
      "example_self": {
        "jp_ruby": "思[おも]っていたよりよほど難[むずか]しくて、途中[とちゅう]で何度[なんど]も解[と]き直[なお]した。",
        "zh": "比我原先想的难多了，做到一半还反复重做。",
        "note": "基准是心里的预期，主观感强。"
      },
      "example_other": {
        "jp_ruby": "今年[ことし]の試験[しけん]は去年[きょねん]以上[いじょう]に難[むずか]しくて、時間[じかん]が足[た]りなかった。",
        "zh": "今年的考试比去年还难，时间都不够。",
        "note": "把“去年”这个参照点说得很清楚。"
      },
      "exam_handle": "如果空格前后出现明确比较基准，如 `去年`、`前回`、`以前`，而句子重点是“比那个更”，先想 `以上に`；如果没有硬基准，重点是“程度高得不普通”，更像 `よほど / よっぽど`。"
    }
  ],
  "memory_chain": "这条记忆链可以这样串：`わずかに` 是刻度 barely 动一下，`一応` 是先碰到及格线，`以上に` 是拿着基准往上比；到了 `よほど / よっぽど`，就不是普通地“更一点”了，而是高到让人觉得“怪不得会这样”。做题时先听量级，再听语气：一点点、姑且够、比基准更高，还是已经高到超出常态。"
}