{
  "entry_id": "n5_053_no_desu",
  "card_blurb": "把一句事实说成“事情是这样的”。「のです」是解释型句尾的完整、正式版。",
  "feel": "听起来像：我不是只报一个结果，我是在把后面的原因、前情、背景一起补给你。比「んです」更整齐，也更像说明、告知、郑重解释的口气。",
  "family_position": "它站在这个家族最前面的“解释背景”那一格，和「んです」几乎是同一个功能位。区别不在意思大变，而在外形更完整、语气更正式。再往后走到「ね」「よ」「なあ」「だろう／でしょう」，重心就会从“解释”慢慢转到“共享、提醒、感叹、推测”。",
  "scene_paragraph": "想象一下，同事看到你下午就开始收东西，顺口问一句为什么这么早走。普通句尾只是把动作说出去；换成「のです」，就像顺手把没说出口的背景也交代了。它不是像「ね」那样拉对方一起认同，也不是像「よ」那样把信息推给对方，而是先把“事情为什么会这样”说明白。比起口语里更常听见的「んです」，「のです」更完整，也更适合老师、店员、公告、说明文那种整齐一点的口气。",
  "scene_examples": [
    {
      "tag": "请假说明",
      "jp_ruby": "今日[きょう]は早[はや]く帰[かえ]るのです。子[こ]どもが熱[ねつ]を出[だ]したのです。",
      "zh": "我今天要早点回去。因为孩子发烧了。",
      "note": "先说动作，再把真正背景补出来。"
    },
    {
      "tag": "店员解释",
      "jp_ruby": "この席[せき]は使[つか]えないのです。今[いま]、掃除[そうじ]中[ちゅう]なのです。",
      "zh": "这个座位现在不能用。因为正在清扫。",
      "note": "比单说“不能用”更像在做说明。"
    },
    {
      "tag": "补交理由",
      "jp_ruby": "昨日[きのう]は学校[がっこう]を休[やす]んだのです。朝[あさ]から頭[あたま]が痛[いた]かったのです。",
      "zh": "我昨天请假没去学校。因为从早上开始就头疼。",
      "note": "很适合回答“为什么没来”这类追问。"
    }
  ],
  "formula": "普通形 + のです / 名詞・な形容詞 + な + のです / 普通形 + のですか",
  "formula_explainer": "前面先按正常句子造好，再把句尾收成「のです」；如果是名词或な形容词，要补一个「な」。变成「のですか」时，常常不是只问事实，而是在问“是怎么回事”。",
  "structure_cards": [
    {
      "label": "动作后面收成解释口气",
      "note": "动词普通形后直接接，把“做什么”说成“事情是这样的”。",
      "jp_ruby": "今日[きょう]は歩[ある]いて帰[かえ]るのです。",
      "zh": "我今天是走路回去的。",
      "mini_note": "重点不只是动作本身，而是带出一种“我来说明一下”的感觉。"
    },
    {
      "label": "名词、な形容词前要有「な」",
      "note": "这类词不能直接接「のです」，中间要先站一个「な」。",
      "jp_ruby": "この町[まち]は静[しず]かなのです。",
      "zh": "这个镇子是安静的。",
      "mini_note": "学习时最容易漏掉的就是这个「な」。"
    },
    {
      "label": "「のですか」是在追问背景",
      "note": "做成问句后，语气常常变成“能解释一下吗”。",
      "jp_ruby": "どうして昨日[きのう]は休[やす]んだのですか。",
      "zh": "你昨天为什么请假了呢？",
      "mini_note": "不是只问结果，而是在要原因和情况。"
    }
  ],
  "usage_points": [
    "「のです」的核心不是单纯“加强语气”，而是把一句话变成“我来解释一下”的口气。",
    "它和「んです」功能几乎一样，但「のです」外形更完整，正式度也更高。",
    "接续时，动词和い形容词直接接普通形；名词和な形容词前要先有「な」。",
    "过去、否定、疑问都能照常放进来，真正变化的是前半句，解释感留在句尾。",
    "它特别适合回答“为什么”、补充理由、说明规定、做温和辩解。",
    "如果上下文根本不需要交代背景，硬加「のです」会让句子显得前情很重，不如普通陈述自然。"
  ],
  "contrasts": [
    {
      "other_entry_id": "n5_046_ndesu",
      "title": "のです vs んです",
      "self_label": "完整、稍正式的解释",
      "other_label": "口语里的解释",
      "difference": "两者功能几乎一样，都是把句子收成“事情是这样的”。差别主要在语体：『のです』更完整、更整齐；『んです』更像真实对话里自然缩出来的口气。",
      "example_self": {
        "jp_ruby": "今日[きょう]は店[みせ]が休[やす]みなのです。中[なか]を掃除[そうじ]するのです。",
        "zh": "今天店里休息。因为要在里面打扫。",
        "note": "像说明、告示、较郑重的解释。"
      },
      "example_other": {
        "jp_ruby": "今日[きょう]は店[みせ]が休[やす]みなんです。中[なか]を掃除[そうじ]するんです。",
        "zh": "今天店里休息。因为要打扫。",
        "note": "意思几乎一样，但更像口头会话。"
      },
      "exam_handle": "如果两个都能接，而整句口气偏正式、说明文、老师或公告语气，优先看「のです」；日常对话、口语叙述里更常见的是「んです」。"
    },
    {
      "other_entry_id": "n5_047_ne",
      "title": "のです vs ね",
      "self_label": "先解释原因",
      "other_label": "先共享感受",
      "difference": "『のです』是在补背景、交代理由；『ね』是在把听者拉进来，确认“你也这么觉得吧”。一个往后挖原因，一个往外找共感。",
      "example_self": {
        "jp_ruby": "この部屋[へや]は寒[さむ]いのです。窓[まど]を閉[し]めましょう。",
        "zh": "这个房间很冷。我们把窗户关上吧。",
        "note": "先把后面动作的理由交代出来。"
      },
      "example_other": {
        "jp_ruby": "この部屋[へや]は寒[さむ]いですね。窓[まど]を閉[し]めましょう。",
        "zh": "这个房间很冷呢。我们把窗户关上吧。",
        "note": "先和对方共享“你也觉得冷吧”的感觉。"
      },
      "exam_handle": "空格如果是在为后句铺理由、补说明，选「のです」；如果是在求认同、拉共感、像中文的“对吧/是吧”，选「ね」。"
    },
    {
      "other_entry_id": "n5_083_yo",
      "title": "のです vs よ",
      "self_label": "把背景说出来",
      "other_label": "把信息推给对方",
      "difference": "『のです』像在回答“为什么会这样”；『よ』像在把信息告诉对方、提醒对方。前者重解释，后者重新信息和提醒感。",
      "example_self": {
        "jp_ruby": "私[わたし]は先[さき]に帰[かえ]るのです。明日[あした]は朝[あさ]が早[はや]いのです。",
        "zh": "我先回去了。因为我明天得很早起。",
        "note": "重点在说明自己为什么先走。"
      },
      "example_other": {
        "jp_ruby": "私[わたし]は先[さき]に帰[かえ]るよ。",
        "zh": "我先回去了哦。",
        "note": "重点是把信息告诉对方。"
      },
      "exam_handle": "如果空格处听起来像“事情是这样的，所以……”，选「のです」；如果更像“我告诉你喔”“你要知道喔”，选「よ」。"
    }
  ],
  "memory_chain": "先记住这条线：想把一句话做成解释，完整一点是「のです」，口语里缩起来常是「んです」；离开解释以后，想把对方拉进同感里会用「ね」，想把信息推出去会用「よ」，想拖成长一点的感叹会靠「なあ」，再往前一步才走到「だろう／でしょう」的推测与确认。放回这条链里看，「のです」就是全家最像“我来把背景说清楚”的那一格。"
}