{
  "entry_id": "n2_095_ni_kotaete",
  "card_blurb": "前面先有“声音”，后面才有“接招”：它强调的是回应请求、期待、声援或需求。",
  "feel": "这句听起来像“那边已经喊话了，这边马上正面接招”。不是单纯受影响，而是带着“回应、不负、给出动作”的方向感。",
  "family_position": "它站在本家族的“回应对象”这一格：`がきっかけで / をきっかけに`、`を契機に`负责交代“从哪件事开始动”，`に応えて`则进一步说清“是对谁、对什么声音动起来”；再往后到`につけ`，连主动回应都不一定有，只要一碰触发点，反应就自己冒出来。",
  "scene_paragraph": "会议室里，运营把最近一周的用户留言投到屏幕上：晚上太亮、字太小、切换太麻烦。第二天更新公告一发，大家一看就懂，这次不是“顺手改了点东西”，而是在明确回应那些意见。`に応えて`就很适合这种画面：前面有人发出需求、期待、掌声，后面的人或组织把它接住，做出对应动作。",
  "scene_examples": [
    {
      "tag": "产品更新",
      "jp_ruby": "利用者[りようしゃ]の声[こえ]に応[こた]えて、アプリに夜間[やかん]モードが追加[ついか]された。",
      "zh": "应用户意见，App 增加了夜间模式。",
      "note": "很典型的“听到反馈就改”。"
    },
    {
      "tag": "演出返场",
      "jp_ruby": "観客[かんきゃく]のアンコールに応[こた]えて、歌手[かしゅ]は予定[よてい]になかった曲[きょく]まで歌[うた]ってくれた。",
      "zh": "应观众返场呼声，歌手连原本没安排的歌都唱了。",
      "note": "前面是呼声，后面是现场回应。"
    },
    {
      "tag": "门店运营",
      "jp_ruby": "旅行者[りょこうしゃ]の需要[じゅよう]に応[こた]えて、この店[みせ]は朝[あさ]六時[ろくじ]から営業[えいぎょう]するようになった。",
      "zh": "为了回应游客需求，这家店改成早上六点开始营业。",
      "note": "商业语境里很常见。"
    }
  ],
  "formula": "N（要望・期待・声援・需要など）に応えて、...",
  "formula_explainer": "前项通常是“可被回应的声音”或“明确的期待/需求”，后项则是人或组织采取的对应动作。句子的重心不在“起因”，而在“回应得很到位”。",
  "structure_cards": [
    {
      "label": "回应请求",
      "note": "最常见，公告语里尤其多。",
      "jp_ruby": "お客[きゃく]さまの要望[ようぼう]に応[こた]えて、土日[どにち]も相談[そうだん]できる窓口[まどぐち]を設[もう]けました。",
      "zh": "应顾客要求，我们开设了周末也能咨询的窗口。",
      "mini_note": "前项是请求，后项是对应措施。"
    },
    {
      "label": "回应声援",
      "note": "不只制度变化，现场动作也能用。",
      "jp_ruby": "ファンの声援[せいえん]に応[こた]えて、選手[せんしゅ]は試合後[しあいご]も長[なが]く手[て]を振[ふ]っていた。",
      "zh": "回应粉丝的加油声，选手在赛后也一直挥手。",
      "mini_note": "有“接住支持”的感觉。"
    },
    {
      "label": "回应需求",
      "note": "商务、新闻、发布稿里很自然。",
      "jp_ruby": "海外[かいがい]の需要[じゅよう]に応[こた]えて、このメーカーは小型[こがた]モデルも発売[はつばい]した。",
      "zh": "为了回应海外需求，这家厂商也推出了小型款。",
      "mini_note": "常和発売、追加、導入这类动作搭配。"
    }
  ],
  "usage_points": [
    "`に応えて`前面最好是能被“接住”的东西，所以和`要望・期待・声・需要・拍手・アンコール`特别合拍。",
    "后项通常是有意识的回应动作，比如追加、実施、発売、再演、発表；如果只是自然发生的结果，语感就不对。",
    "它强调“针对那个对象作出回应”，所以比普通“因为……”更有方向感，像是在回答、满足、回馈。",
    "既能用于正式公告，也能用于现场场景。`需要に応えて`偏书面，`拍手に応えて`、`アンコールに応えて`则很有临场感。",
    "当前项是`期待`时，中文常能译成“回应期待”“不负期待”，语气会比单纯的“因为有期待”更积极。"
  ],
  "contrasts": [
    {
      "other_entry_id": "n2_024_ga_kikkake_de_o_kikkake_ni",
      "title": "に応えて vs をきっかけに",
      "self_label": "按需求回应",
      "other_label": "借事件启动",
      "difference": "`に応えて`前面是明确的要求、声音或需求，后面像在接招；`をきっかけに`前面则是一个契机事件，后面是从那里开始展开，不强调是在回应谁。",
      "example_self": {
        "jp_ruby": "利用者[りようしゃ]の要望[ようぼう]に応[こた]えて、図書館[としょかん]は返却[へんきゃく]ポストを駅前[えきまえ]にも設置[せっち]した。",
        "zh": "应使用者要求，图书馆也在车站前设置了还书箱。",
        "note": "有人提了要求，所以给出对应措施。"
      },
      "example_other": {
        "jp_ruby": "駅前[えきまえ]の再開発[さいかいはつ]をきっかけに、図書館[としょかん]は返却[へんきゃく]ポストの場所[ばしょ]を見直[みなお]した。",
        "zh": "以车站前再开发为契机，图书馆重新调整了还书箱的位置。",
        "note": "不是回应谁，而是借一个事件启动调整。"
      },
      "exam_handle": "空格前如果是`要望`、`声`、`リクエスト`这类“可被回应的对象”，优先想`に応えて`；如果前项只是一个事件、变化、经历，意思是“以此为开端”，更像`をきっかけに`。"
    },
    {
      "other_entry_id": "n2_123_o_keiki_ni",
      "title": "に応えて vs を契機に",
      "self_label": "面向具体需求作回应",
      "other_label": "把事件定为正式转折点",
      "difference": "`を契機に`也有“由某事带起来”的意思，但更像把某件事上升成正式转折点，语气更书面、更宏观；`に応えて`则是面对具体需求、期待或声援作回应。",
      "example_self": {
        "jp_ruby": "海外[かいがい]の顧客[こきゃく]の需要[じゅよう]に応[こた]えて、会社[かいしゃ]は英語[えいご]版[ばん]のサポート窓口[まどぐち]を作[つく]った。",
        "zh": "为了回应海外客户的需求，公司设立了英文支持窗口。",
        "note": "焦点在“有这个需求，所以给出对应服务”。"
      },
      "example_other": {
        "jp_ruby": "海外[かいがい]進出[しんしゅつ]を契機[けいき]に、会社[かいしゃ]はサポート体制[たいせい]を全面的[ぜんめんてき]に見直[みなお]した。",
        "zh": "以进军海外为契机，公司全面调整了客服体系。",
        "note": "焦点在“借这个阶段变化，整体进入新局面”。"
      },
      "exam_handle": "如果空格前是`需要`、`要請`、`期待`，后面又是满足它的措施，优先选`に応えて`；如果前项是组织层面的事件，如进军、事故、制度变更，后面是借此展开新阶段，多半是`を契機に`。"
    },
    {
      "other_entry_id": "n2_110_ni_tsuke",
      "title": "に応えて vs につけ",
      "self_label": "受到刺激后主动回应",
      "other_label": "每逢触发就自然起反应",
      "difference": "`に応えて`是“外部刺激一来，我有意识地回应”；`につけ`是“每逢某触发，情绪或想法就跟着冒出来”，不一定有对外动作。",
      "example_self": {
        "jp_ruby": "観客[かんきゃく]の拍手[はくしゅ]に応[こた]えて、監督[かんとく]は予定外[よていがい]のトークまでしてくれた。",
        "zh": "回应观众的掌声，导演连计划外的谈话环节都加上了。",
        "note": "掌声来了，于是做出现场回应。"
      },
      "example_other": {
        "jp_ruby": "あの劇場[げきじょう]で拍手[はくしゅ]を聞[き]くにつけ、初日[しょにち]の緊張[きんちょう]を思[おも]い出[だ]す。",
        "zh": "每次在那个剧场听到掌声，我都会想起首演那天的紧张。",
        "note": "不是回应掌声，而是每逢听到就勾起回忆。"
      },
      "exam_handle": "如果后项是人主动采取的回应动作，如再唱一首、增加服务、发表声明，用`に応えて`；如果是“每当……就想起/感到……”，尤其带回忆或感情波动，往往是`につけ`。"
    }
  ],
  "memory_chain": "这一组可以这样串：`がきっかけで / をきっかけに`先告诉你“事情从哪儿开始动”，`を契機に`把这个起点升级成更正式的转折；到了`に応えて`，重点不再是“借机开始”，而是“外面有声音，我这边接住并回应”；最后`につけ`则更内化，只要一碰到那个触发点，情绪或念头就自己冒出来。放回整条链里记，`に応えて`就是最像“接球回球”的那一格。"
}