{
  "entry_id": "n4_056_nasaru",
  "card_blurb": "尊他版的 `する`。说客人、老师、上司“要做 / 会做 / 怎么做”时，常把普通的 `する` 换成 `なさる`，一句话立刻有服务业和正式场景的距离感。",
  "feel": "这句听起来像店员、秘书、下属把对方的动作轻轻托高一层：不是普通地说“做”，而是在说“您这边怎么决定 / 这位会怎么处理”。",
  "family_position": "它在这组家族里，正好站在“尊他版 `する`”这一格，和 `いたします` 形成对位：`いたします` 是我方降下来，`なさる` 是把对方抬上去。再往外扩，就是更通用的 `お〜になる`；再把语气转成请求，就会接到 `お〜ください`。",
  "scene_paragraph": "百货店柜台前，店员不会直接问你「何にする？」；她会笑着说「何になさいますか」。医院候诊区里，前台也不会随便说“医生等会儿做说明”，而是说「先生があとでご説明なさいます」。动作本身没变，变的是说话人的站位：`なさる` 不是在讲“做”这个事实，而是在给做这件事的人留出尊敬距离。",
  "scene_examples": [
    {
      "tag": "店员询问选择",
      "jp_ruby": "お飲[の]み物[もの]は、何[なに]になさいますか。",
      "zh": "饮料您要选什么呢？",
      "note": "把客人的“选、决定”抬高，是服务场景里特别常见的说法。"
    },
    {
      "tag": "公司转述上司安排",
      "jp_ruby": "部長[ぶちょう]は午後[ごご]に最終[さいしゅう]確認[かくにん]をなさいます。",
      "zh": "部长下午会做最终确认。",
      "note": "说上司要做什么，用 `なさる` 比普通 `する` 更合适。"
    },
    {
      "tag": "诊所前台说明流程",
      "jp_ruby": "先生[せんせい]がこのあと手術[しゅじゅつ]の流[なが]れをご説明[せつめい]なさいます。",
      "zh": "医生接下来会为您说明手术流程。",
      "note": "公告、接待、说明场合里很自然，正式但不生硬。"
    }
  ],
  "formula": "（目上の人・客）が する → なさる／Nをなさる／ご＋サ変名詞＋なさる／何になさいますか",
  "formula_explainer": "`なさる` 就是把 `する` 直接换成尊敬说法。它既能单独顶替 `する`，也常和 `ご説明`、`ご出席` 这类サ变名词连用；在服务日语里，`何になさいますか`、`どうなさいますか` 更是高频固定问法。",
  "structure_cards": [
    {
      "label": "直接把 `する` 抬高",
      "note": "最核心的替换关系先记住。",
      "jp_ruby": "お飲[の]み物[もの]は、何[なに]になさいますか。",
      "zh": "饮料您选什么呢？",
      "mini_note": "对应普通说法 `何にする`。"
    },
    {
      "label": "`ご＋サ变名词＋なさる`",
      "note": "正式通知、接待说明里很常见。",
      "jp_ruby": "先生[せんせい]があとでご説明[せつめい]なさいます。",
      "zh": "老师稍后会为您说明。",
      "mini_note": "把 `説明する` 抬高成 `ご説明なさる`。"
    },
    {
      "label": "`なさって` 也要顺手记",
      "note": "这个活用很常用，考试也爱碰。",
      "jp_ruby": "どうぞ、ご自由[じゆう]になさってください。",
      "zh": "请您随意。",
      "mini_note": "`て` 形是 `なさって`，不是按普通规则硬拐。"
    }
  ],
  "usage_points": [
    "`なさる` 说的是“对方 / 上位者 / 客人做”，不是“我来做”。自己这边要做，家族里通常改用 `いたします`。",
    "它最常见的语感不是特别夸张的敬语，而是服务业、接待、正式转述里的自然尊敬，尤其像 `どうなさいますか`、`何になさいますか` 这种问句。",
    "活用要特别记：礼貌形常见 `なさいます`，`て` 形是 `なさって`，过去常见 `なさいました`。这类地方最容易按普通 `る` 动词误推。",
    "和サ变名词连用很高频，比如 `ご説明なさる`、`ご出席なさる`、`ご判断なさる`。看到“某位尊者要进行某动作”时，很容易往这条路上想。",
    "`お〜になる` 也能做尊敬表达，但 `なさる` 是 `する` 这条线上的专用对应，所以听感更像“直接把 `する` 升级”。",
    "句子里一旦用了 `なさる`，主语的身份通常已经被说话人往上放了；如果主语只是普通朋友或自己人，用它会显得过头。"
  ],
  "contrasts": [
    {
      "other_entry_id": "n4_024_itashimasu",
      "title": "なさる vs いたします",
      "self_label": "上位者来做",
      "other_label": "我方来做",
      "difference": "`なさる` 是把对方或上位者的“做”抬高；`いたします` 是把自己这边的“做”压低。两边都和 `する` 有关，但敬语方向完全相反。",
      "example_self": {
        "jp_ruby": "部長[ぶちょう]がこのあとご説明[せつめい]なさいます。",
        "zh": "部长接下来会为您说明。",
        "note": "动作者是上司，所以往上抬。"
      },
      "example_other": {
        "jp_ruby": "このあと私[わたし]がご説明[せつめい]いたします。",
        "zh": "接下来由我来为您说明。",
        "note": "动作者是自己，所以用自谦。"
      },
      "exam_handle": "先看主语站哪边。空格里如果是“对方 / 上位者来做”，优先想 `なさる`；如果是“我来做 / 我方负责”，大多是 `いたします`。"
    },
    {
      "other_entry_id": "n4_066_o_ni_naru",
      "title": "なさる vs お〜になる",
      "self_label": "`する` 的专用尊敬",
      "other_label": "更通用的尊敬骨架",
      "difference": "两者都能把动作抬高，但 `なさる` 是 `する` 的专门尊敬说法；`お〜になる` 是可以套很多动词的通用框架。考试里如果题目明显围着 `する` 转，`なさる` 往往更直接。",
      "example_self": {
        "jp_ruby": "社長[しゃちょう]は明日[あした]の会議[かいぎ]にご出席[しゅっせき]なさいます。",
        "zh": "社长明天会出席会议。",
        "note": "直接把“出席する”抬高。"
      },
      "example_other": {
        "jp_ruby": "社長[しゃちょう]は明日[あした]の会議[かいぎ]にご出席[しゅっせき]になります。",
        "zh": "社长明天会出席会议。",
        "note": "同样尊敬，但走的是模板型骨架。"
      },
      "exam_handle": "如果题目就是在考 `する` 的尊敬对应，尤其在固定敬语问句或常用转述里，先想 `なさる`；如果题目更像在考“套尊敬框架”，再考虑 `お〜になる`。"
    },
    {
      "other_entry_id": "n4_065_o_kudasai",
      "title": "なさる vs お〜ください",
      "self_label": "尊敬地说他会做",
      "other_label": "礼貌地请对方去做",
      "difference": "`なさる` 是在描述或询问尊者的动作；`お〜ください` 则是把句子转成请求，对着对方说“请您做”。一个是陈述/提问，一个是拜托。",
      "example_self": {
        "jp_ruby": "社長[しゃちょう]はこの件[けん]を明日[あした]ご判断[はんだん]なさいます。",
        "zh": "社长会在明天判断这件事。",
        "note": "是在说明尊者将要采取的动作。"
      },
      "example_other": {
        "jp_ruby": "この件[けん]は、明日[あした]までにご判断[はんだん]ください。",
        "zh": "这件事请您在明天之前作出判断。",
        "note": "这里已经不是描述，而是在礼貌请求。"
      },
      "exam_handle": "看句子是在“说他会不会做”，还是“请他去做”。前者往 `なさる` 走，后者通常就是 `お〜ください`。"
    }
  ],
  "memory_chain": "这条家族线可以这样串：先用 `ございます / でございます` 建立“正式、礼貌”的底色；再进到动作敬语时，记专用尊敬动词 `いらっしゃる` 管“来、去、在”，`いたします` 管“我方来做”，`なさる` 管“对方去做”。如果不只想记单个专用词，而想整批把动词抬高，就接到 `お〜になる`；如果还要把尊敬动作变成礼貌请求，再落到 `お〜ください`。所以 `なさる` 就是这条链中最关键的一格：它把 `する` 从普通动作，拉进了“尊他”的核心位置。"
}