{
  "entry_id": "n5_061_o_kudasai",
  "card_blurb": "点单、拿票、领表、补讲义时最顺手的一句：把想要的东西放在前面，再说「をください」。",
  "feel": "这句听起来像把手伸过去说：“这个请给我一下。”礼貌、直接、很生活化，重点不是拜托别人费力帮忙，而是把某样东西递到你手上。",
  "family_position": "它在本家族里站“请求实物”这一格：前面「お / ご」只是给名词套礼貌外壳，到了「をください」才真正开口要东西；如果请求升级成“请你做某个动作”，就换到家族邻居「てください」；再往后才是「ませんか」「ましょう」「ましょうか」这些邀请或主动出手。",
  "scene_paragraph": "这个句型最常出现的镜头，是你站在柜台、教室、窗口前，手里没有那样东西，但马上就需要它。你指着面包、表格、讲义、饮料，说一句「メロンパンを二つください」。这不是命令，也不是长篇解释，而是很明确地把“我要这个”说出来。它的语感落点，是东西从对方那里到你这里；所以它和「てください」最大的分界线就是：前者要的是“东西”，后者要的是“动作”。",
  "scene_examples": [
    {
      "tag": "面包店",
      "jp_ruby": "メロンパンを二[ふた]つください。",
      "zh": "请给我两个菠萝包。",
      "note": "买东西时最典型，东西和数量一起说。"
    },
    {
      "tag": "教室",
      "jp_ruby": "すみません、プリントをもう一[いち]枚[まい]ください。",
      "zh": "不好意思，请再给我一张讲义。",
      "note": "不是请老师去做什么，而是把讲义再递一份。"
    },
    {
      "tag": "窗口",
      "jp_ruby": "申[もう]し込[こ]み書[しょ]をください。",
      "zh": "请给我申请表。",
      "note": "表格、票据、资料这类能递给你的东西都很常这样说。"
    }
  ],
  "formula": "名词 + をください",
  "formula_explainer": "前面放你想拿到手的东西，后面用「ください」把它变成礼貌请求。整句的方向感很明确：请把这个给我。",
  "structure_cards": [
    {
      "label": "基本款",
      "note": "最短、最常用的要东西句型。",
      "jp_ruby": "水[みず]をください。",
      "zh": "请给我水。",
      "mini_note": "先说要的东西，再说「ください」。"
    },
    {
      "label": "指定对象",
      "note": "把“这一个”先锁定，再开口要。",
      "jp_ruby": "この切符[きっぷ]をください。",
      "zh": "请给我这张票。",
      "mini_note": "前面可放「この / その / あの」来点名目标。"
    },
    {
      "label": "带数量",
      "note": "名词后面直接补数量，像真实点单。",
      "jp_ruby": "りんごを三[みっ]つください。",
      "zh": "请给我三个苹果。",
      "mini_note": "数量常跟着名词一起出现，说法更完整。"
    }
  ],
  "usage_points": [
    "「をください」前面放的是能被递给你、拿给你、发给你的对象，比如水、票、表格、讲义、面包。",
    "它不拿来请求动作。想说“请写”“请看”“请等一下”，要换成「てください」。",
    "在店里点单、柜台办事、课堂补资料时，这句非常自然；语气礼貌，但不绕弯。",
    "想说得更柔和一点，前面常加一句「すみません」：如「すみません、プリントをください」。",
    "数量经常直接放进去：如「パンを二[ふた]つください」。这样比只说名词更像真实会话。",
    "教材先记标准形「これをください」；真实口语里也常省成「これください」。另外家族里的「お / ご」还能先给名词加礼貌壳，如「お水[みず]をください」。"
  ],
  "contrasts": [
    {
      "other_entry_id": "n5_072_te_kudasai",
      "title": "をください vs てください",
      "self_label": "要东西",
      "other_label": "要动作",
      "difference": "「をください」是在要某样东西本身；「てください」是在请对方做一个动作。一个看名词能不能递给你，一个看动作是不是要对方来完成。",
      "example_self": {
        "jp_ruby": "申[もう]し込[こ]み書[しょ]をください。",
        "zh": "请给我申请表。",
        "note": "我要的是表格这件东西。"
      },
      "example_other": {
        "jp_ruby": "申[もう]し込[こ]み書[しょ]を書[か]いてください。",
        "zh": "请填写申请表。",
        "note": "我要的是“写”这个动作。"
      },
      "exam_handle": "空格前如果是在说一个要拿到手的名词，多半选「をください」；如果句子是在要求对方做事、前面该接动词变化，就看「てください」。"
    },
    {
      "other_entry_id": "n5_031_masen_ka",
      "title": "をください vs ませんか",
      "self_label": "请把东西给我",
      "other_label": "要不要一起做",
      "difference": "「をください」是向对方要东西；「ませんか」是把话题推进成邀请，问对方愿不愿意一起行动。",
      "example_self": {
        "jp_ruby": "コーヒーをください。",
        "zh": "请给我一杯咖啡。",
        "note": "对店员点单，要的是饮料。"
      },
      "example_other": {
        "jp_ruby": "コーヒーを飲[の]みませんか。",
        "zh": "要不要一起喝咖啡？",
        "note": "对朋友发出邀请，要的是一起行动。"
      },
      "exam_handle": "如果语境是点单、买东西、领资料，通常是「をください」；如果是在约人、邀人一起做某事，通常是「ませんか」。"
    },
    {
      "other_entry_id": "n5_033_mashouka",
      "title": "をください vs ましょうか",
      "self_label": "我开口要东西",
      "other_label": "我来帮你做吧",
      "difference": "「をください」是向别人提出需求；「ましょうか」是说话人主动接手，表示“要不要我来……？”",
      "example_self": {
        "jp_ruby": "スプーンをください。",
        "zh": "请给我一个勺子。",
        "note": "客人向店员要物品。"
      },
      "example_other": {
        "jp_ruby": "スプーンを持[も]ってきましょうか。",
        "zh": "要不要我给您拿个勺子？",
        "note": "店员主动提出帮忙。"
      },
      "exam_handle": "先看谁在出手：向别人要物品，用「をください」；说话人主动表示“我来拿、我来做”，用「ましょうか」。"
    }
  ],
  "memory_chain": "先用「お / ご」把名词包得更礼貌，再用「をください」把“请给我这个”说出口；如果你要的不是东西而是动作，就切到「てください」；如果关系往前推，变成邀请同行，是「ませんか / ましょう」；如果轮到我主动帮你出手，就是「ましょうか」。"
}