{
  "entry_id": "n5_027_mada",
  "card_blurb": "把事情放到现在这一刻看：它还在继续，或者还没轮到它发生。",
  "feel": "像盯着进度条说：先别催，还没到下一格；或者先别收，状态还挂在那里。",
  "family_position": "它站在本家族后半段的“进度判断”格。前面的「とき」「前に」「てから」是在切时间点和先后，到了「まだ」，镜头不再换，而是盯着现在看事情卡在哪一格。它和「もう」正好一左一右；再往细里收，就会变成更具体的「まだ〜ていません」。",
  "scene_paragraph": "晚上在站台等人，朋友发来一句「もう着いた？」。你抬头看电子屏，电车还没进站；手里的咖啡还烫；回到家又有人问作业做完了吗。这个时候会连续冒出几个「まだ」：まだ来ない、まだ熱い、まだ終わってない。它的核心不是单纯否定，而是把眼前事情按在“现在”这一格上说：先别往后翻，事情还没走到下一步。",
  "scene_examples": [
    {
      "tag": "站台等车",
      "jp_ruby": "電車[でんしゃ]、まだ来[き]ませんね。寒[さむ]いから、中[なか]で待[ま]ちましょう。",
      "zh": "电车还没来啊。太冷了，我们进去等吧。",
      "note": "预期会来，但现在这一刻还没到。"
    },
    {
      "tag": "咖啡太烫",
      "jp_ruby": "そのコーヒー、まだ熱[あつ]いよ。少[すこ]し待[ま]ったほうがいい。",
      "zh": "那杯咖啡还烫呢。最好再等一下。",
      "note": "接肯定句时，是“状态还在继续”。"
    },
    {
      "tag": "催作业",
      "jp_ruby": "A：宿題[しゅくだい]、終[お]わった？ B：ごめん、まだ。今[いま]やってる。",
      "zh": "A：作业做完了吗？ B：抱歉，还没。我现在正在做。",
      "note": "会话里常直接说「まだ」，后半句靠场景补出来。"
    }
  ],
  "formula": "まだ + 状态句 / まだ + 否定句 / まだ(です)",
  "formula_explainer": "「まだ」本质上是副词，不是拿来切前后顺序的连接词。它放在你想判断进度的内容前面：接肯定句时，像把镜头停在旧状态上；接否定句时，像说“下一步还没发生”。口语里也常直接收成「まだ。」或「まだです。」",
  "structure_cards": [
    {
      "label": "状态还在",
      "note": "接形容词或状态句",
      "jp_ruby": "外[そと]はまだ暗[くら]いです。",
      "zh": "外面还很黑。",
      "mini_note": "不是动作没做，而是状态还没有变过去。"
    },
    {
      "label": "动作还没发生",
      "note": "接否定句，说预期中的事还没来",
      "jp_ruby": "バスはまだ来[き]ません。",
      "zh": "公交车还没来。",
      "mini_note": "默认之后会来，只是现在还停在“未到达”这格。"
    },
    {
      "label": "短回答",
      "note": "问进度时可以直接收住",
      "jp_ruby": "A：準備[じゅんび]、できた？ B：まだです。",
      "zh": "A：准备好了吗？ B：还没有。",
      "mini_note": "很常见，也很自然，省掉重复信息。"
    }
  ],
  "usage_points": [
    "「まだ」最像“进度条还没走到下一格”，所以它特别常出现在等人、等车、等完成、等变凉这类有预期终点的场景里。",
    "接肯定句时，多半是“还在这个状态里”：例如还热、还小、还在睡。",
    "接否定句时，多半是“预期会发生，但现在还没”：例如还没来、还不知道、还没开始。",
    "会话里单独回答「まだ。」或「まだです。」非常自然，尤其是在对方问“好了没、来了没、可以没”的时候。",
    "如果你想把“还没做某个动作”说得更完整、更像考试标准答案，常常会落到更具体的「まだ〜ていません」。",
    "它不表示习惯频率，所以不能拿来代替「いつも」；「まだ」看的是现在的进度，「いつも」看的是平常的重复。"
  ],
  "contrasts": [
    {
      "other_entry_id": "n5_035_mou",
      "title": "まだ vs もう",
      "self_label": "还没吃午饭",
      "other_label": "已经吃完午饭",
      "difference": "「まだ」站在未完成这边看现在，「もう」站在已经跨过去那边看现在。它们像同一根进度条的左右两侧。",
      "example_self": {
        "jp_ruby": "昼[ひる]ご飯[はん]はまだです。",
        "zh": "午饭还没吃。",
        "note": "回答停在“还没到吃完这一步”。"
      },
      "example_other": {
        "jp_ruby": "昼[ひる]ご飯[はん]はもう食[た]べました。",
        "zh": "午饭已经吃过了。",
        "note": "回答已经跨过“吃饭”这一步。"
      },
      "exam_handle": "题目如果在同一基准点问完成还是未完成，就先看有没有“越线”的感觉：越线选「もう」，没越线选「まだ」。"
    },
    {
      "other_entry_id": "n5_028_mada_te_imasen",
      "title": "まだ vs まだ〜ていません",
      "self_label": "作业还没好",
      "other_label": "作业还没有做完",
      "difference": "「まだ」可以只笼统表示“还没到这一步”或“还在这一步”；「まだ〜ていません」则把“哪一个动作还没完成”明确说出来。",
      "example_self": {
        "jp_ruby": "宿題[しゅくだい]はまだです。",
        "zh": "作业还没好。",
        "note": "只给整体进度，不把动作说满。"
      },
      "example_other": {
        "jp_ruby": "宿題[しゅくだい]はまだ終[お]わっていません。",
        "zh": "作业还没有做完。",
        "note": "把“做完”这个动作明确点出来。"
      },
      "exam_handle": "如果空格后面已经出现「ていません」，或者语境要明确写出“某动作没做”，优先想整块「まだ〜ていません」；只想简短说“还没到这一步”，选「まだ」。"
    },
    {
      "other_entry_id": "n5_030_mae_ni",
      "title": "まだ vs 前に",
      "self_label": "电影还没开始",
      "other_label": "在电影开始前先做别的事",
      "difference": "「まだ」是在判断当前进度；「前に」是在拿另一件事当时间界线。一个看状态，一个切顺序。",
      "example_self": {
        "jp_ruby": "映画[えいが]はまだ始[はじ]まっていません。",
        "zh": "电影还没开始。",
        "note": "从现在看，开始这一步还没到。"
      },
      "example_other": {
        "jp_ruby": "映画[えいが]が始[はじ]まる前[まえ]に、飲[の]み物[もの]を買[か]いましょう。",
        "zh": "在电影开始前，我们先去买饮料吧。",
        "note": "把“开始前”当成时间点来安排动作。"
      },
      "exam_handle": "如果空格后面接的是另一个事件作参照点，常是「前に」；如果题目在问“现在到底到了没、还在不在”，优先想「まだ」。"
    }
  ],
  "memory_chain": "先用「とき」找到时间点，用「前に」「てから」排出先后，再来到进度区：过线了是「もう」，没过线或状态还挂着就是「まだ」；如果要把“还没做”说得更完整，就再收紧成「まだ〜ていません」。"
}